game_id,rated.x,treat_type,chat_type,opp_respond,rated.y,variant,speed,perf,createdAt,lastMoveAt,status,players,winner,moves,analysis,clock,white_rating,white_ratingDiff,white_inaccuracy,white_mistake,white_blunder,white_acpl,white_accuracy,white_player,black_rating,black_ratingDiff,black_inaccuracy,black_mistake,black_blunder,black_acpl,black_accuracy,black_player,opponent_color,op_rating,op_ratingDiff,op_inaccuracy,op_mistake,op_blunder,op_acpl,op_accuracy,op_player,Event,Site,Date,Round,White,Black,Result,Movetext,NMoves,W1,B1,W2,B2,W3,B3,W4,B4,W5,B5,W6,B6,W7,B7,W8,B8,W9,B9,W10,B10,last.move,complete.movetext,W_B_moves,W_K_moves,W_N_moves,W_O_moves,W_Q_moves,W_R_moves,B_B_moves,B_K_moves,B_N_moves,B_O_moves,B_Q_moves,B_R_moves,B_moves,K_moves,N_moves,O_moves,Q_moves,R_moves
fT0iabYV,TRUE,0,Placebo,FALSE,TRUE,standard,rapid,rapid,1699541053304,1699541248760,mate,"{'white': {'user': {'name': 'TRESDORUS', 'id': 'tresdorus'}, 'rating': 1172, 'ratingDiff': -8, 'analysis': {'inaccuracy': 2, 'mistake': 0, 'blunder': 2, 'acpl': 98, 'accuracy': 60}}, 'black': {'user': {'name': 'sandman353', 'id': 'sandman353'}, 'rating': 1240, 'ratingDiff': 13, 'analysis': {'inaccuracy': 1, 'mistake': 1, 'blunder': 0, 'acpl': 27, 'accuracy': 84}}}",black,d4 Nc6 Nf3 d5 e3 Bf5 c4 e6 Nc3 Bb4 a3 Bxc3+ bxc3 Nf6 cxd5 Qxd5 c4 Qa5+ Bd2 Qb6 c5 Qb2 Ne5 Nxe5 dxe5 Ne4 Ba5 Qxf2#,"[{'eval': 0}, {'eval': 89, 'best': 'g8f6', 'variation': 'Nf6 c4 e6 Nf3 d5 cxd5 exd5 Bf4 c6 Nc3', 'judgment': {'name': 'Inaccuracy', 'comment': 'Inaccuracy. Nf6 was best.'}}, {'eval': 73}, {'eval': 72}, {'eval': 62}, {'eval': 69}, {'eval': 48}, {'eval': 54}, {'eval': -40, 'best': 'a2a3', 'variation': 'a3 Nf6 b4 Be7 c5 Nb8 Be2 O-O O-O c6', 'judgment': {'name': 'Inaccuracy', 'comment': 'Inaccuracy. a3 was best.'}}, {'eval': 75, 'best': 'c6b4', 'variation': 'Nb4 Kd2 dxc4 Bxc4 Nf6 a3 Nbd5 Ke2 Be7 Bd2', 'judgment': {'name': 'Mistake', 'comment': 'Mistake. Nb4 was best.'}}, {'eval': 44}, {'eval': 41}, {'eval': 37}, {'eval': 52}, {'eval': 47}, {'eval': 86}, {'eval': 96}, {'eval': 146}, {'eval': 134}, {'eval': 139}, {'eval': 54, 'best': 'f3h4', 'variation': 'Nh4 Ne4', 'judgment': {'name': 'Inaccuracy', 'comment': 'Inaccuracy. Nh4 was best.'}}, {'eval': 63}, {'eval': -259, 'best': 'd1c1', 'variation': 'Qc1', 'judgment': {'name': 'Blunder', 'comment': 'Blunder. Qc1 was best.'}}, {'eval': -258}, {'eval': -264}, {'eval': -243}, {'mate': -1, 'best': 'd1c1', 'variation': 'Qc1 Qxe5', 'judgment': {'name': 'Blunder', 'comment': 'Checkmate is now unavoidable. Qc1 was best.'}}]","{'initial': 600, 'increment': 0, 'totalTime': 600}",1172,-8,2,0,2,98,60,TRESDORUS,1240,13,1,1,0,27,84,sandman353,white,1172,-8,2,0,2,98,60,TRESDORUS,Rated Rapid game,https://lichess.org/fT0iabYV,2023.11.09,,TRESDORUS,sandman353,0-1,1. d4 Nc6 2. Nf3 d5 3. e3 Bf5 4. c4 e6 5. Nc3 Bb4 6. a3 Bxc3+ 7. bxc3 Nf6 8. cxd5 Qxd5 9. c4 Qa5+ 10. Bd2 Qb6 11. c5 Qb2 12. Ne5 Nxe5 13. dxe5 Ne4 14. Ba5 Qxf2#,14,d4,Nc6,Nf3,d5,e3,Bf5,c4,e6,Nc3,Bb4,a3,Bxc3+,bxc3,Nf6,cxd5,Qxd5,c4,Qa5+,Bd2,Qb6,Qxf2#,TRUE,2,0,3,0,0,0,3,0,4,0,5,0,5,0,7,0,5,0
jJ0JAPIo,TRUE,1,Placebo,FALSE,TRUE,standard,rapid,rapid,1699561590798,1699561932635,mate,"{'white': {'user': {'name': 'sandman353', 'id': 'sandman353'}, 'rating': 1311, 'ratingDiff': 11, 'analysis': {'inaccuracy': 5, 'mistake': 1, 'blunder': 1, 'acpl': 57, 'accuracy': 81}}, 'black': {'user': {'name': 'afranks11', 'id': 'afranks11'}, 'rating': 1397, 'ratingDiff': -12, 'analysis': {'inaccuracy': 4, 'mistake': 1, 'blunder': 3, 'acpl': 104, 'accuracy': 69}}}",white,Nc3 Nf6 e4 d6 g3 g6 Bg2 Bg7 d3 O-O f4 Bg4 Bf3 Bxf3 Qxf3 Nbd7 Be3 Re8 O-O-O a6 Nge2 b5 h4 h5 f5 Ne5 Qf4 b4 Nd5 Nxd5 exd5 Ng4 fxg6 Nxe3 Qxe3 fxg6 Qe6+ Kh7 Nf4 Bf6 Qf7+ Kh8 Nxg6#,"[{'eval': -13}, {'eval': 12}, {'eval': 0}, {'eval': 72, 'best': 'd7d5', 'variation': 'd5 e5 Nfd7 f4 c5 d4 e6 Nf3 Nc6 Be3', 'judgment': {'name': 'Inaccuracy', 'comment': 'Inaccuracy. d5 was best.'}}, {'eval': 0, 'best': 'd2d4', 'variation': 'd4 e5 Nf3 Nbd7 a4 Be7 Bc4 c6 O-O h6', 'judgment': {'name': 'Inaccuracy', 'comment': 'Inaccuracy. d4 was best.'}}, {'eval': 39}, {'eval': 1}, {'eval': 57, 'best': 'c7c5', 'variation': 'c5 Nge2 Bg7 O-O O-O a4 Nc6 d3 Rb8 Nd5', 'judgment': {'name': 'Inaccuracy', 'comment': 'Inaccuracy. c5 was best.'}}, {'eval': 0, 'best': 'd2d4', 'variation': 'd4 O-O h3 e5 Nge2 c6 a4 Re8 Be3 exd4', 'judgment': {'name': 'Inaccuracy', 'comment': 'Inaccuracy. d4 was best.'}}, {'eval': 1}, {'eval': 0}, {'eval': 37}, {'eval': -17}, {'eval': -21}, {'eval': -43}, {'eval': 80, 'best': 'c7c5', 'variation': 'c5 Qg2 Nc6 Nf3 b5 O-O b4 Nd1 c4 Kh1 a5 Be3 a4 Nf2', 'judgment': {'name': 'Mistake', 'comment': 'Mistake. c5 was best.'}}, {'eval': 0, 'best': 'g3g4', 'variation': 'g4 a5 Nge2 a4 a3 e6 Bd2 b5 O-O Qb8 g5 Nh5 f5 Bxc3', 'judgment': {'name': 'Inaccuracy', 'comment': 'Inaccuracy. g4 was best.'}}, {'eval': 51}, {'eval': 21}, {'eval': 132, 'best': 'c7c5', 'variation': 'c5 Nge2', 'judgment': {'name': 'Inaccuracy', 'comment': 'Inaccuracy. c5 was best.'}}, {'eval': 110}, {'eval': 128}, {'eval': -94, 'best': 'g3g4', 'variation': 'g4 e6', 'judgment': {'name': 'Blunder', 'comment': 'Blunder. g4 was best.'}}, {'eval': -110}, {'eval': -121}, {'eval': -124}, {'eval': -210, 'best': 'f3g2', 'variation': 'Qg2 Nfg4 Bg5 b4 Nd5 c6 Ne3 Nxe3 Bxe3 Ng4 Qf3 a5 Rhf1 Rf8', 'judgment': {'name': 'Inaccuracy', 'comment': 'Inaccuracy. Qg2 was best.'}}, {'eval': -194}, {'eval': -272, 'best': 'c3a4', 'variation': 'Na4', 'judgment': {'name': 'Inaccuracy', 'comment': 'Inaccuracy. Na4 was best.'}}, {'eval': 27, 'best': 'f6g4', 'variation': 'Nfg4 d4 Bh6 Qxh6 Nxh6 dxe5 Ng4 fxg6 fxg6 Nd4 Qc8 Bg5 c5 exd6', 'judgment': {'name': 'Blunder', 'comment': 'Blunder. Nfg4 was best.'}}, {'eval': 12}, {'eval': 38}, {'eval': 0}, {'eval': 628, 'best': 'f7g6', 'variation': 'fxg6 Qe4 Nxe3 Qe6+ Kh8 Nf4 Nxd1 Nxg6+ Kh7 Nf4 Kh8', 'judgment': {'name': 'Blunder', 'comment': 'Blunder. fxg6 was best.'}}, {'eval': 324, 'best': 'g6f7', 'variation': 'gxf7+ Kh7 Qe4+ Kh8 fxe8=Q+ Qxe8 Qxe3 a5 Nf4 a4 Kb1 b3 cxb3 axb3', 'judgment': {'name': 'Mistake', 'comment': 'Mistake. gxf7+ was best.'}}, {'eval': 367}, {'eval': 372}, {'eval': 530, 'best': 'g8h8', 'variation': 'Kh8 Qxg6 e5 dxe6 Qf6 Qxf6 Bxf6 Rhf1 Bg7 Nf4 Bh6 Rde1 Rab8 Kd2', 'judgment': {'name': 'Inaccuracy', 'comment': 'Inaccuracy. Kh8 was best.'}}, {'eval': 512}, {'mate': 7, 'best': 'h7h8', 'variation': 'Kh8 Qxg6 e5 dxe6 Qf6 Qxf6 Bxf6 Nd5 Bd8 e7 Rxe7 Nxe7 Bxe7 Rdf1', 'judgment': {'name': 'Blunder', 'comment': 'Checkmate is now unavoidable. Kh8 was best.'}}, {'mate': 6}, {'mate': 1}]","{'initial': 600, 'increment': 0, 'totalTime': 600}",1311,11,5,1,1,57,81,sandman353,1397,-12,4,1,3,104,69,afranks11,black,1397,-12,4,1,3,104,69,afranks11,Rated Rapid game,https://lichess.org/jJ0JAPIo,2023.11.09,,sandman353,afranks11,1-0,1. Nc3 Nf6 2. e4 d6 3. g3 g6 4. Bg2 Bg7 5. d3 O-O 6. f4 Bg4 7. Bf3 Bxf3 8. Qxf3 Nbd7 9. Be3 Re8 10. O-O-O a6 11. Nge2 b5 12. h4 h5 13. f5 Ne5 14. Qf4 b4 15. Nd5 Nxd5 16. exd5 Ng4 17. fxg6 Nxe3 18. Qxe3 fxg6 19. Qe6+ Kh7 20. Nf4 Bf6 21. Qf7+ Kh8 22. Nxg6#,22,Nc3,Nf6,e4,d6,g3,g6,Bg2,Bg7,d3,O-O,f4,Bg4,Bf3,Bxf3,Qxf3,Nbd7,Be3,Re8,O-O-O,a6,Nxg6#,TRUE,3,1,5,1,5,1,4,3,6,1,0,2,7,4,11,2,5,3
jnQhATj7,TRUE,1,Chatty,FALSE,TRUE,standard,rapid,rapid,1699627311629,1699627851092,mate,"{'white': {'user': {'name': 'sandman353', 'id': 'sandman353'}, 'rating': 1313, 'ratingDiff': -8, 'analysis': {'inaccuracy': 3, 'mistake': 1, 'blunder': 4, 'acpl': 81, 'accuracy': 70}}, 'black': {'user': {'name': 'Traumatorte', 'id': 'traumatorte'}, 'rating': 1340, 'ratingDiff': 17, 'analysis': {'inaccuracy': 4, 'mistake': 0, 'blunder': 3, 'acpl': 61, 'accuracy': 74}}}",black,Nc3 e5 Nf3 Nc6 d4 d6 Bg5 Be7 Bxe7 Qxe7 e3 Nf6 Bb5 O-O O-O Bf5 dxe5 dxe5 Bxc6 bxc6 Re1 Rfd8 Qe2 Rab8 b3 Rd6 e4 Bg6 Rad1 Rbd8 Rxd6 Rxd6 Rd1 h6 Rxd6 Qxd6 h3 Qb4 Qd3 Nxe4 Nxe4 Bxe4 Qd8+ Kh7 Nxe5 Qe1+ Kh2 Bxc2 Nxf7 Qxf2 Qh8+ Kg6 Ne5+ Kf5 Qxg7 Qf4+ g3 Qxe5 Qxe5+ Kxe5 h4 a5 Kh3 Kd4 g4 Bb1 g5 hxg5 hxg5 Bxa2 g6 Bxb3 g7 a4 Kg4 a3 Kg5 a2 Kg6 a1=Q Kh7 Qh1+ Kg6 Ke5 Kg5 Qg2+ Kh6 Kf6 Kh7 Qh2#,"[{'eval': -13}, {'eval': 38}, {'eval': 39}, {'eval': 18}, {'eval': 40}, {'eval': 79}, {'eval': 13, 'best': 'e2e4', 'variation': 'e4 exd4 Nxd4 Be7 Bb5 Bd7 Nxc6 bxc6 Bd3 Bf6', 'judgment': {'name': 'Inaccuracy', 'comment': 'Inaccuracy. e4 was best.'}}, {'eval': 25}, {'eval': 35}, {'eval': 35}, {'eval': 8}, {'eval': 7}, {'eval': -14}, {'eval': -11}, {'eval': -21}, {'eval': 14}, {'eval': -16}, {'eval': 17}, {'eval': 11}, {'eval': 21}, {'eval': -2}, {'eval': 8}, {'eval': 0}, {'eval': 12}, {'eval': -26}, {'eval': 63, 'best': 'f6d5', 'variation': 'Nd5', 'judgment': {'name': 'Inaccuracy', 'comment': 'Inaccuracy. Nd5 was best.'}}, {'eval': 64}, {'eval': 121, 'best': 'f5g4', 'variation': 'Bg4 h3 Bxf3 Qxf3 Rbd8 Nd1 Rd2 Ne3 g6 Rac1 R2d4 Nc4 Kg7 Re3', 'judgment': {'name': 'Inaccuracy', 'comment': 'Inaccuracy. Bg4 was best.'}}, {'eval': 10, 'best': 'e2a6', 'variation': 'Qa6 Bh5', 'judgment': {'name': 'Mistake', 'comment': 'Mistake. Qa6 was best.'}}, {'eval': 18}, {'eval': -9}, {'eval': 91, 'best': 'c7d6', 'variation': 'cxd6 Nh4 Qb7 Qd3 Qb8 Nxg6 hxg6 Qc4 d5 Qc5 d4 Na4 d3 f3', 'judgment': {'name': 'Inaccuracy', 'comment': 'Inaccuracy. cxd6 was best.'}}, {'eval': 0, 'best': 'e2e3', 'variation': 'Qe3 Bh5 Nd2 Ng4 Qe2 Qh4 Nf3 Qe7 Nb1 Nh6 Nbd2 f6 Qe3 a6', 'judgment': {'name': 'Inaccuracy', 'comment': 'Inaccuracy. Qe3 was best.'}}, {'eval': 22}, {'eval': -11}, {'eval': 29}, {'eval': 17}, {'eval': 1}, {'eval': 0}, {'eval': 0}, {'eval': 0}, {'eval': 0}, {'eval': 0}, {'eval': 0}, {'eval': -460, 'best': 'd8h4', 'variation': 'Qh4 f5 Kh2 Kg8 Qd8+ Kh7 Qh4', 'judgment': {'name': 'Blunder', 'comment': 'Blunder. Qh4 was best.'}}, {'eval': -464}, {'eval': -461}, {'eval': 10, 'best': 'e1f2', 'variation': 'Qxf2 Nf3 Qxc2 Qd2 Qxd2 Nxd2 Bd5 Kg3 Kg6 Kf2 Kf6 g3 Ke5 Ke3', 'judgment': {'name': 'Blunder', 'comment': 'Blunder. Qxf2 was best.'}}, {'eval': 8}, {'eval': 417, 'best': 'e1e6', 'variation': 'Qe6 Qxc7 Bb1 Nd8 Qf5 f3 Bxa2 Nxc6 Bxb3 Nxa7 Be6 Qd6 Bd7 h4', 'judgment': {'name': 'Blunder', 'comment': 'Blunder. Qe6 was best.'}}, {'eval': 354}, {'eval': 371}, {'eval': 393}, {'eval': 575, 'best': 'g6h5', 'variation': 'Kh5 Qe8+', 'judgment': {'name': 'Inaccuracy', 'comment': 'Inaccuracy. Kh5 was best.'}}, {'eval': 0, 'best': 'h8f8', 'variation': 'Qf8+ Kxe5 Qxf2 Ke6 Qxa7 Bxb3 Qxc7 Kf6 Qxc6+ Kf7 Qc7+ Kg8 a3 g6', 'judgment': {'name': 'Blunder', 'comment': 'Blunder. Qf8+ was best.'}}, {'eval': 0}, {'mate': -3, 'best': 'h2h1', 'variation': 'Kh1 Qc1+ Kh2 Qf4+', 'judgment': {'name': 'Blunder', 'comment': 'Checkmate is now unavoidable. Kh1 was best.'}}, {'eval': 5, 'best': 'f4f2', 'variation': 'Qf2+ Kh1 Be4+ Nf3 Bxf3#', 'judgment': {'name': 'Blunder', 'comment': 'Lost forced checkmate sequence. Qf2+ was best.'}}, {'eval': -553, 'best': 'g7h7', 'variation': 'Qh7+ Ke6 Qxc2 Kd7 Kg2 Qd5+ Kf2 Kc8 g4 Qh1 Kg3 Qe1+ Qf2 Qe5+', 'judgment': {'name': 'Blunder', 'comment': 'Blunder. Qh7+ was best.'}}, {'eval': -567}, {'eval': -644}, {'eval': -690}, {'eval': -702}, {'eval': -667}, {'eval': -677}, {'eval': -692}, {'eval': -727}, {'eval': -699}, {'eval': -3671, 'best': 'h4h5', 'variation': 'h5 Ke5 Kg4 Kf6 a4 c5 h6 Kg6 h7 Bf5+ Kf3 Kg7 h8=Q+ Kxh8', 'judgment': {'name': 'Inaccuracy', 'comment': 'Inaccuracy. h5 was best.'}}, {'mate': -14}, {'mate': -13}, {'mate': -13}, {'mate': -14}, {'mate': -13}, {'mate': -11}, {'mate': -10}, {'mate': -11}, {'mate': -8}, {'mate': -7}, {'mate': -6}, {'mate': -5}, {'mate': -5}, {'mate': -5}, {'mate': -4}, {'mate': -2}, {'mate': -3}, {'mate': -3}, {'mate': -2}, {'mate': -1}]","{'initial': 600, 'increment': 0, 'totalTime': 600}",1313,-8,3,1,4,81,70,sandman353,1340,17,4,0,3,61,74,Traumatorte,black,1340,17,4,0,3,61,74,Traumatorte,Rated Rapid game,https://lichess.org/jnQhATj7,2023.11.10,,sandman353,Traumatorte,0-1,1. Nc3 e5 2. Nf3 Nc6 3. d4 d6 4. Bg5 Be7 5. Bxe7 Qxe7 6. e3 Nf6 7. Bb5 O-O 8. O-O Bf5 9. dxe5 dxe5 10. Bxc6 bxc6 11. Re1 Rfd8 12. Qe2 Rab8 13. b3 Rd6 14. e4 Bg6 15. Rad1 Rbd8 16. Rxd6 Rxd6 17. Rd1 h6 18. Rxd6 Qxd6 19. h3 Qb4 20. Qd3 Nxe4 21. Nxe4 Bxe4 22. Qd8+ Kh7 23. Nxe5 Qe1+ 24. Kh2 Bxc2 25. Nxf7 Qxf2 26. Qh8+ Kg6 27. Ne5+ Kf5 28. Qxg7 Qf4+ 29. g3 Qxe5 30. Qxe5+ Kxe5 31. h4 a5 32. Kh3 Kd4 33. g4 Bb1 34. g5 hxg5 35. hxg5 Bxa2 36. g6 Bxb3 37. g7 a4 38. Kg4 a3 39. Kg5 a2 40. Kg6 a1=Q 41. Kh7 Qh1+ 42. Kg6 Ke5 43. Kg5 Qg2+ 44. Kh6 Kf6 45. Kh7 Qh2#,45,Nc3,e5,Nf3,Nc6,d4,d6,Bg5,Be7,Bxe7,Qxe7,e3,Nf6,Bb5,O-O,O-O,Bf5,dxe5,dxe5,Bxc6,bxc6,Qh2#,TRUE,4,11,6,1,6,6,8,8,3,1,10,6,12,19,9,2,16,12
jtGmwW5I,TRUE,0,Placebo,FALSE,TRUE,standard,rapid,rapid,1699561963384,1699562519043,mate,"{'white': {'user': {'name': 'sandman353', 'id': 'sandman353'}, 'rating': 1322, 'ratingDiff': -10, 'analysis': {'inaccuracy': 1, 'mistake': 2, 'blunder': 3, 'acpl': 64, 'accuracy': 79}}, 'black': {'user': {'name': 'biff65', 'id': 'biff65'}, 'rating': 1274, 'ratingDiff': 7, 'analysis': {'inaccuracy': 3, 'mistake': 1, 'blunder': 3, 'acpl': 45, 'accuracy': 89}}}",black,Nc3 d5 Nf3 Nf6 d3 d4 Ne4 e6 Nxf6+ Qxf6 Bg5 Qf5 Qd2 f6 Bf4 e5 Bg3 Bd6 Nh4 Qg5 Qxg5 fxg5 Nf5 Bxf5 O-O-O Nc6 e4 Be6 Be2 O-O-O h4 Be7 hxg5 Bxg5+ Kb1 Nb4 Bxe5 Bxa2+ Ka1 Rhe8 Bxg7 Rd6 Rxh7 Ra6 Bg4+ Kb8 Bxd4 Bg8+ Kb1 Bxh7 c3 Nc6 Bd7 Rd8 Bxc6 bxc6 Rh1 Rd7 Rxh7 Rxh7 g3 Rh1+ Kc2 Be7 f4 c5 Be5 Kc8 f5 Kd8 g4 Rg1 f6 Bxf6 Bxf6+ Rxf6 e5 Re6 d4 cxd4 cxd4 Rxg4 Kc3 Kd7 b4 Rg3+ Kc4 c6 Kc5 Rc3#,"[{'eval': -13}, {'eval': 0}, {'eval': -25}, {'eval': -23}, {'eval': -66}, {'eval': -4, 'best': 'c7c5', 'variation': 'c5 g3 d4 Nb1 Nc6 Bg2 e5 O-O h6 e3', 'judgment': {'name': 'Inaccuracy', 'comment': 'Inaccuracy. c5 was best.'}}, {'eval': -8}, {'eval': 8}, {'eval': 29}, {'eval': 28}, {'eval': 6}, {'eval': 37}, {'eval': -101, 'best': 'c2c3', 'variation': 'c3', 'judgment': {'name': 'Mistake', 'comment': 'Mistake. c3 was best.'}}, {'eval': -106}, {'eval': -106}, {'eval': -107}, {'eval': -97}, {'eval': 24, 'best': 'g7g5', 'variation': 'g5 h3 h5 e3 c5 Qd1 Nc6 Be2 Bd7 Nd2 Qg6 Bf3 O-O-O Nc4', 'judgment': {'name': 'Mistake', 'comment': 'Mistake. g5 was best.'}}, {'eval': -112, 'best': 'e2e3', 'variation': 'e3', 'judgment': {'name': 'Mistake', 'comment': 'Mistake. e3 was best.'}}, {'eval': 124, 'best': 'f5e6', 'variation': 'Qe6 e4', 'judgment': {'name': 'Blunder', 'comment': 'Blunder. Qe6 was best.'}}, {'eval': 114}, {'eval': 110}, {'eval': -512, 'best': 'h4f3', 'variation': 'Nf3 g4 Nxe5 h5 h3 Nc6 Nxc6 bxc6 Bxd6 cxd6 g3 Ke7 hxg4 Bxg4', 'judgment': {'name': 'Blunder', 'comment': 'Blunder. Nf3 was best.'}}, {'eval': -512}, {'eval': -526}, {'eval': -513}, {'eval': -564}, {'eval': -545}, {'eval': -546}, {'eval': -518}, {'eval': -535}, {'eval': -515}, {'eval': -514}, {'eval': -518}, {'eval': -516}, {'eval': -389, 'best': 'h7h6', 'variation': 'h6 Bh4 Rdf8 Bxg5 hxg5 Rc1 Kd7 Rxh8 Rxh8 c3 g4 Bd1 dxc3 bxc3', 'judgment': {'name': 'Inaccuracy', 'comment': 'Inaccuracy. h6 was best.'}}, {'eval': -376}, {'eval': -385}, {'eval': -390}, {'eval': -287, 'best': 'a2e6', 'variation': 'Be6 c3 Nc6 Bxg7 Rhg8 Bxd4 Nxd4 cxd4 Rxd4 g3 Bf6 Rxh7 Rb4 Rd2', 'judgment': {'name': 'Inaccuracy', 'comment': 'Inaccuracy. Be6 was best.'}}, {'eval': -254}, {'eval': -46, 'best': 'a2e6', 'variation': 'Be6 Rh5 h6 c3 Nc6 Bxh6 Bxh6 Rxh6 Bb3 Rc1 Rf8 f3 Rg8 g4', 'judgment': {'name': 'Blunder', 'comment': 'Blunder. Be6 was best.'}}, {'eval': -561, 'best': 'c2c3', 'variation': 'c3', 'judgment': {'name': 'Blunder', 'comment': 'Blunder. c3 was best.'}}, {'eval': -563}, {'eval': -568}, {'eval': -593}, {'mate': -1, 'best': 'b2b3', 'variation': 'b3 Bxb3+ Kb2 Bxc2 Bxd4 Bxd1 Bxd1 Rd8 Rh5 Be7 Rh7 Nxd3+ Kb1 Rxd4', 'judgment': {'name': 'Blunder', 'comment': 'Checkmate is now unavoidable. b3 was best.'}}, {'mate': -2}, {'mate': -2}, {'eval': -574, 'best': 'g8a2', 'variation': 'Ba2+ Ka1 Nxc2#', 'judgment': {'name': 'Blunder', 'comment': 'Lost forced checkmate sequence. Ba2+ was best.'}}, {'eval': -710}, {'eval': -579}, {'eval': -664}, {'eval': -579}, {'eval': -569}, {'eval': -551}, {'eval': -550}, {'eval': -498}, {'eval': -583}, {'eval': -587}, {'eval': -587}, {'eval': -594}, {'eval': -577}, {'eval': -596}, {'eval': -607}, {'eval': -624}, {'eval': -673}, {'eval': -586}, {'eval': -595}, {'eval': -598}, {'eval': -615}, {'eval': -627}, {'eval': -745}, {'eval': -747}, {'eval': -797}, {'eval': -834}, {'eval': -1065}, {'eval': -822}, {'eval': -925}, {'eval': -996}, {'eval': -3706}, {'eval': -3645}, {'mate': -15, 'best': 'c2d3', 'variation': 'Kd3 Ke7 b4 Rb6 Kc3 Rg1 d5 Rg3+ Kd2 Rxb4 Ke2 a5 Kf1 a4', 'judgment': {'name': 'Inaccuracy', 'comment': 'Checkmate is now unavoidable. Kd3 was best.'}}, {'mate': -21}, {'mate': -10}, {'mate': -5}, {'mate': -5}, {'mate': -10}, {'mate': -1}]","{'initial': 600, 'increment': 0, 'totalTime': 600}",1322,-10,1,2,3,64,79,sandman353,1274,7,3,1,3,45,89,biff65,black,1274,7,3,1,3,45,89,biff65,Rated Rapid game,https://lichess.org/jtGmwW5I,2023.11.09,,sandman353,biff65,0-1,1. Nc3 d5 2. Nf3 Nf6 3. d3 d4 4. Ne4 e6 5. Nxf6+ Qxf6 6. Bg5 Qf5 7. Qd2 f6 8. Bf4 e5 9. Bg3 Bd6 10. Nh4 Qg5 11. Qxg5 fxg5 12. Nf5 Bxf5 13. O-O-O Nc6 14. e4 Be6 15. Be2 O-O-O 16. h4 Be7 17. hxg5 Bxg5+ 18. Kb1 Nb4 19. Bxe5 Bxa2+ 20. Ka1 Rhe8 21. Bxg7 Rd6 22. Rxh7 Ra6 23. Bg4+ Kb8 24. Bxd4 Bg8+ 25. Kb1 Bxh7 26. c3 Nc6 27. Bd7 Rd8 28. Bxc6 bxc6 29. Rh1 Rd7 30. Rxh7 Rxh7 31. g3 Rh1+ 32. Kc2 Be7 33. f4 c5 34. Be5 Kc8 35. f5 Kd8 36. g4 Rg1 37. f6 Bxf6 38. Bxf6+ Rxf6 39. e5 Re6 40. d4 cxd4 41. cxd4 Rxg4 42. Kc3 Kd7 43. b4 Rg3+ 44. Kc4 c6 45. Kc5 Rc3#,45,Nc3,d5,Nf3,Nf6,d3,d4,Ne4,e6,Nxf6+,Qxf6,Bg5,Qf5,Qd2,f6,Bf4,e5,Bg3,Bd6,Nh4,Qg5,Rc3#,TRUE,12,8,6,1,2,4,10,5,4,1,3,14,22,13,10,2,5,18
kSwLSZCQ,TRUE,1,Placebo,FALSE,TRUE,standard,rapid,rapid,1699559804946,1699560105211,resign,"{'white': {'user': {'name': 'sandman353', 'id': 'sandman353'}, 'rating': 1293, 'ratingDiff': 8, 'analysis': {'inaccuracy': 1, 'mistake': 0, 'blunder': 0, 'acpl': 12, 'accuracy': 96}}, 'black': {'user': {'name': 'Pokesito', 'id': 'pokesito'}, 'rating': 1229, 'ratingDiff': -5, 'analysis': {'inaccuracy': 1, 'mistake': 0, 'blunder': 1, 'acpl': 55, 'accuracy': 77}}}",white,Nc3 Nf6 e4 e5 g3 b6 Bg2 Bb7 Nge2 Bb4 O-O O-O a3 Bxc3 Nxc3 d5 d3 dxe4 dxe4 Qxd1 Rxd1 Nbd7 Bg5 Rad8 Nd5 Bxd5 exd5 h6 Bxf6 Nxf6 c4 Rfe8 b4 e4 Re1 Re7 Rad1 c6 dxc6 Rxd1 Rxd1 e3 fxe3 Rxe3 c7 Re8 Rd8,"[{'eval': -13}, {'eval': 12}, {'eval': 0}, {'eval': 17}, {'eval': 0}, {'eval': 60, 'best': 'f8c5', 'variation': 'Bc5 Bg2 O-O Nge2 c6 O-O d5 exd5 cxd5 d4', 'judgment': {'name': 'Inaccuracy', 'comment': 'Inaccuracy. Bc5 was best.'}}, {'eval': 47}, {'eval': 86}, {'eval': 75}, {'eval': 103}, {'eval': 74}, {'eval': 109}, {'eval': 91}, {'eval': 78}, {'eval': 103}, {'eval': 80}, {'eval': 84}, {'eval': 80}, {'eval': 93}, {'eval': 107}, {'eval': 110}, {'eval': 140}, {'eval': 100}, {'eval': 142}, {'eval': 110}, {'eval': 83}, {'eval': 117}, {'eval': 85}, {'eval': 24, 'best': 'g5e3', 'variation': 'Be3 Ng4 Bc1 Rfe8 b4 e4 h3 Ngf6 c4 Ne5 Bf1 c6 d6 Nfd7', 'judgment': {'name': 'Inaccuracy', 'comment': 'Inaccuracy. Be3 was best.'}}, {'eval': 33}, {'eval': 36}, {'eval': 34}, {'eval': 29}, {'eval': 28}, {'eval': 31}, {'eval': 34}, {'eval': 29}, {'eval': 615, 'best': 'g8f8', 'variation': 'Kf8', 'judgment': {'name': 'Blunder', 'comment': 'Blunder. Kf8 was best.'}}, {'eval': 631}, {'eval': 706}, {'eval': 684}, {'eval': 810}, {'eval': 827}, {'eval': 1025}, {'eval': 1028}, {'eval': 1105}, {'eval': 1045}]","{'initial': 600, 'increment': 0, 'totalTime': 600}",1293,8,1,0,0,12,96,sandman353,1229,-5,1,0,1,55,77,Pokesito,black,1229,-5,1,0,1,55,77,Pokesito,Rated Rapid game,https://lichess.org/kSwLSZCQ,2023.11.09,,sandman353,Pokesito,1-0,1. Nc3 Nf6 2. e4 e5 3. g3 b6 4. Bg2 Bb7 5. Nge2 Bb4 6. O-O O-O 7. a3 Bxc3 8. Nxc3 d5 9. d3 dxe4 10. dxe4 Qxd1 11. Rxd1 Nbd7 12. Bg5 Rad8 13. Nd5 Bxd5 14. exd5 h6 15. Bxf6 Nxf6 16. c4 Rfe8 17. b4 e4 18. Re1 Re7 19. Rad1 c6 20. dxc6 Rxd1 21. Rxd1 e3 22. fxe3 Rxe3 23. c7 Re8 24. Rd8,24,Nc3,Nf6,e4,e5,g3,b6,Bg2,Bb7,Nge2,Bb4,O-O,O-O,a3,Bxc3,Nxc3,d5,d3,dxe4,dxe4,Qxd1,Rd8,TRUE,3,1,4,1,0,6,4,1,3,1,1,7,7,2,7,2,1,13
klRz3sw5,TRUE,0,Chatty,FALSE,TRUE,standard,rapid,rapid,1699902253142,1699902557071,mate,"{'white': {'user': {'name': 'siberoloji', 'id': 'siberoloji'}, 'rating': 1358, 'ratingDiff': -7, 'analysis': {'inaccuracy': 5, 'mistake': 2, 'blunder': 1, 'acpl': 59, 'accuracy': 81}}, 'black': {'user': {'name': 'sandman353', 'id': 'sandman353'}, 'rating': 1357, 'ratingDiff': 7, 'analysis': {'inaccuracy': 5, 'mistake': 1, 'blunder': 0, 'acpl': 30, 'accuracy': 89}}}",black,d4 Nc6 Bf4 d5 e3 Bf5 Bg3 Nb4 Na3 e6 f4 Nf6 Nf3 Ne4 c3 Nc6 Ne5 Nxe5 dxe5 Bxa3 bxa3 Nxc3 Qb3 Ne4 Bb5+ c6 Bxc6+ bxc6 Qb7 O-O Qxc6 Qa5+ Kf1 Nd2+ Kf2 Ne4+ Kf3 Rac8 Qd6 Nxd6 Be1 Be4+ Kg4 Qxa3 Bh4 Qxe3 Rac1 Rxc1 Rxc1 Qxc1 Be7 Bf5+ Kh4 Qxf4+ Kh5 Qg4#,"[{'eval': 0}, {'eval': 89, 'best': 'g8f6', 'variation': 'Nf6 c4 e6 Nf3 d5 cxd5 exd5 Bf4 c6 Nc3', 'judgment': {'name': 'Inaccuracy', 'comment': 'Inaccuracy. Nf6 was best.'}}, {'eval': 36}, {'eval': 59}, {'eval': 50}, {'eval': 69}, {'eval': -5, 'best': 'c2c4', 'variation': 'c4 Nf6 Nc3 e6 a3 Be7 Rc1 O-O Nf3 h6', 'judgment': {'name': 'Inaccuracy', 'comment': 'Inaccuracy. c4 was best.'}}, {'eval': 33}, {'eval': 3}, {'eval': 9}, {'eval': -133, 'best': 'c2c3', 'variation': 'c3 Nc6', 'judgment': {'name': 'Mistake', 'comment': 'Mistake. c3 was best.'}}, {'eval': -59, 'best': 'c7c5', 'variation': 'c5', 'judgment': {'name': 'Inaccuracy', 'comment': 'Inaccuracy. c5 was best.'}}, {'eval': -106}, {'eval': -33, 'best': 'c7c5', 'variation': 'c5 Bb5+ Nc6 O-O Be7 Bh4 O-O Bxf6 Bxf6 c3 Qb6 Rf2 cxd4 Nxd4', 'judgment': {'name': 'Inaccuracy', 'comment': 'Inaccuracy. c5 was best.'}}, {'eval': -45}, {'eval': -35}, {'eval': -326, 'best': 'a3b1', 'variation': 'Nb1 h5 Bh4 Be7 Bxe7 Nxe7 Nbd2 h4 Be2 c6 O-O Qc7 Qa4 f6', 'judgment': {'name': 'Blunder', 'comment': 'Blunder. Nb1 was best.'}}, {'eval': -226, 'best': 'f8a3', 'variation': 'Bxa3', 'judgment': {'name': 'Inaccuracy', 'comment': 'Inaccuracy. Bxa3 was best.'}}, {'eval': -277}, {'eval': -146, 'best': 'c7c6', 'variation': 'c6 Nc2 Qb6 Rb1 Nxg3 hxg3 Bxc2 Qxc2 Qxe3+ Qe2 Qxg3+ Qf2 Qxf2+ Kxf2', 'judgment': {'name': 'Mistake', 'comment': 'Mistake. c6 was best.'}}, {'eval': -315, 'best': 'd1a4', 'variation': 'Qa4+', 'judgment': {'name': 'Mistake', 'comment': 'Mistake. Qa4+ was best.'}}, {'eval': -324}, {'eval': -322}, {'eval': -339}, {'eval': -367}, {'eval': -386}, {'eval': -610, 'best': 'b5e2', 'variation': 'Be2 O-O Qb2 Qa5+ Kf1 Qb6 Qc1 c5 Be1 f6 g4 Bg6 exf6 Nxf6', 'judgment': {'name': 'Inaccuracy', 'comment': 'Inaccuracy. Be2 was best.'}}, {'eval': -607}, {'eval': -650}, {'eval': -653}, {'eval': -946, 'best': 'e1h1', 'variation': 'O-O c5 Rfb1 c4 Rb5 a6 Rb6 Rc8 Be1 Nc5 Qxc8 Qxc8 Bb4 Be4', 'judgment': {'name': 'Inaccuracy', 'comment': 'Inaccuracy. O-O was best.'}}, {'eval': -1188}, {'eval': -1122}, {'eval': -769}, {'eval': -824}, {'eval': -866}, {'eval': -835}, {'eval': -891}, {'eval': -1369}, {'eval': -1412}, {'mate': -10, 'best': 'h1c1', 'variation': 'Rhc1 Be4+ Ke2 Nf5 a4 d4 Rxc8 Rxc8 Kf1 Qd2', 'judgment': {'name': 'Inaccuracy', 'comment': 'Checkmate is now unavoidable. Rhc1 was best.'}}, {'mate': -9}, {'mate': -9}, {'eval': -1326, 'best': 'a5a6', 'variation': 'Qa6 exd6 f5+ Kh4 Qe2 h3 Rf6 g4 Rh6+ Kg5 Rxh3 Rg1 h6+ Kg6', 'judgment': {'name': 'Inaccuracy', 'comment': 'Lost forced checkmate sequence. Qa6 was best.'}}, {'mate': -5, 'best': 'e1c3', 'variation': 'Bc3 Nf5 Kh3 h5 Rhg1 Qe7 g3 Nxe3 Rae1 Bf5+ g4 Nxg4 Rxg4 Bxg4+', 'judgment': {'name': 'Inaccuracy', 'comment': 'Checkmate is now unavoidable. Bc3 was best.'}}, {'mate': -4}, {'mate': -2}, {'mate': -4}, {'mate': -2}, {'mate': -4}, {'mate': -4}, {'mate': -3}, {'mate': -2}, {'mate': -1}, {'mate': -1}]","{'initial': 600, 'increment': 0, 'totalTime': 600}",1358,-7,5,2,1,59,81,siberoloji,1357,7,5,1,0,30,89,sandman353,white,1358,-7,5,2,1,59,81,siberoloji,Rated Rapid game,https://lichess.org/klRz3sw5,2023.11.13,,siberoloji,sandman353,0-1,1. d4 Nc6 2. Bf4 d5 3. e3 Bf5 4. Bg3 Nb4 5. Na3 e6 6. f4 Nf6 7. Nf3 Ne4 8. c3 Nc6 9. Ne5 Nxe5 10. dxe5 Bxa3 11. bxa3 Nxc3 12. Qb3 Ne4 13. Bb5+ c6 14. Bxc6+ bxc6 15. Qb7 O-O 16. Qxc6 Qa5+ 17. Kf1 Nd2+ 18. Kf2 Ne4+ 19. Kf3 Rac8 20. Qd6 Nxd6 21. Be1 Be4+ 22. Kg4 Qxa3 23. Bh4 Qxe3 24. Rac1 Rxc1 25. Rxc1 Qxc1 26. Be7 Bf5+ 27. Kh4 Qxf4+ 28. Kh5 Qg4#,28,d4,Nc6,Bf4,d5,e3,Bf5,Bg3,Nb4,Na3,e6,f4,Nf6,Nf3,Ne4,c3,Nc6,Ne5,Nxe5,dxe5,Bxa3,Qg4#,TRUE,7,6,3,0,4,2,4,1,11,1,6,3,11,7,14,1,10,5
