game_id,rated.x,treat_type,chat_type,opp_respond,rated.y,variant,speed,perf,createdAt,lastMoveAt,status,players,winner,moves,analysis,clock,white_rating,white_ratingDiff,white_inaccuracy,white_mistake,white_blunder,white_acpl,white_accuracy,white_player,black_rating,black_ratingDiff,black_inaccuracy,black_mistake,black_blunder,black_acpl,black_accuracy,black_player,opponent_color,op_rating,op_ratingDiff,op_inaccuracy,op_mistake,op_blunder,op_acpl,op_accuracy,op_player,Event,Site,Date,Round,White,Black,Result,Movetext,NMoves,W1,B1,W2,B2,W3,B3,W4,B4,W5,B5,W6,B6,W7,B7,W8,B8,W9,B9,W10,B10,last.move,complete.movetext,W_B_moves,W_K_moves,W_N_moves,W_O_moves,W_Q_moves,W_R_moves,B_B_moves,B_K_moves,B_N_moves,B_O_moves,B_Q_moves,B_R_moves,B_moves,K_moves,N_moves,O_moves,Q_moves,R_moves
HwV6aLm7,TRUE,0,Placebo,FALSE,TRUE,standard,rapid,rapid,1699546783814,1699547005556,resign,"{'white': {'user': {'name': 'profVangi', 'id': 'profvangi'}, 'rating': 1301, 'ratingDiff': -6, 'analysis': {'inaccuracy': 4, 'mistake': 1, 'blunder': 2, 'acpl': 119, 'accuracy': 50}}, 'black': {'user': {'name': 'sandman353', 'id': 'sandman353'}, 'rating': 1281, 'ratingDiff': 11, 'analysis': {'inaccuracy': 1, 'mistake': 0, 'blunder': 3, 'acpl': 64, 'accuracy': 64}}}",black,e4 e5 d4 exd4 Qxd4 c5 Qd3 Nc6 Nc3 Nf6 Nd5 d6 Bg5 Be7 Nf3 O-O O-O-O Nxd5 Qxd5 Bxg5+ Nxg5 Be6 Nxe6 fxe6 Qxe6+ Kh8 Rxd6 Qg5+ Rd2 Nd4 f3 Nxe6 Bc4 Nd4 g4 Nxf3 h4 Qxd2+,"[{'eval': 36}, {'eval': 35}, {'eval': -17}, {'eval': 0}, {'eval': -5}, {'eval': 177, 'best': 'b8c6', 'variation': 'Nc6 Qe3 Nf6 Bd2 Be7 Nc3 d5 Nxd5 Nxd5 exd5', 'judgment': {'name': 'Blunder', 'comment': 'Blunder. Nc6 was best.'}}, {'eval': 166}, {'eval': 187}, {'eval': 141}, {'eval': 157}, {'eval': 41, 'best': 'g1f3', 'variation': 'Nf3 d6 Bf4 Be6 O-O-O Qa5 a3 O-O-O Ng5 Kb8', 'judgment': {'name': 'Mistake', 'comment': 'Mistake. Nf3 was best.'}}, {'eval': 42}, {'eval': 45}, {'eval': 51}, {'eval': -27, 'best': 'd5e7', 'variation': 'Nxe7', 'judgment': {'name': 'Inaccuracy', 'comment': 'Inaccuracy. Nxe7 was best.'}}, {'eval': 39, 'best': 'f6d5', 'variation': 'Nxd5', 'judgment': {'name': 'Inaccuracy', 'comment': 'Inaccuracy. Nxd5 was best.'}}, {'eval': -7}, {'eval': -10}, {'eval': -21}, {'eval': 19}, {'eval': -39, 'best': 'd5g5', 'variation': 'Qxg5 Be6 a3 Qxg5+ Nxg5 Rad8 h4 h6 Nh3 d5 exd5 Rxd5 Rxd5 Bxd5', 'judgment': {'name': 'Inaccuracy', 'comment': 'Inaccuracy. Qxg5 was best.'}}, {'eval': 163, 'best': 'c6b4', 'variation': 'Nb4 Qd2', 'judgment': {'name': 'Blunder', 'comment': 'Blunder. Nb4 was best.'}}, {'eval': 166}, {'eval': 159}, {'eval': 163}, {'eval': 161}, {'eval': 126}, {'eval': 141}, {'eval': -440, 'best': 'c1b1', 'variation': 'Kb1', 'judgment': {'name': 'Blunder', 'comment': 'Blunder. Kb1 was best.'}}, {'eval': 188, 'best': 'f8f2', 'variation': 'Rxf2 Qd5 Qf4 g3 Rxf1+ Rxf1 Qxf1+ Rd1 Qf2 Qd2 Qf6 Qf4 Qe7 Qd6', 'judgment': {'name': 'Blunder', 'comment': 'Blunder. Rxf2 was best.'}}, {'eval': -650, 'best': 'e6d5', 'variation': 'Qd5 Qh6 Qxc5 Rad8 f4 Qxf4 Bd3 Qe3 Kd1 b6 Qh5 Nxc2 Qe2 Qxe2+', 'judgment': {'name': 'Blunder', 'comment': 'Blunder. Qd5 was best.'}}, {'eval': -647}, {'eval': -638}, {'eval': -612}, {'eval': -1007, 'best': 'h1d1', 'variation': 'Rd1 Nxf3 gxf3 Rad8 c3 Rxd2 Rxd2 Rd8 Bd5 b5 Kc2 Qf4 a3 Qe3', 'judgment': {'name': 'Inaccuracy', 'comment': 'Inaccuracy. Rd1 was best.'}}, {'eval': -1016}, {'mate': -6, 'best': 'h1d1', 'variation': 'Rd1 Nxd2 Bd3 Rf2 e5 c4 Bf5 Rd8 b3 Nf3+ Kb2', 'judgment': {'name': 'Inaccuracy', 'comment': 'Checkmate is now unavoidable. Rd1 was best.'}}, {'mate': -5}]","{'initial': 600, 'increment': 0, 'totalTime': 600}",1301,-6,4,1,2,119,50,profVangi,1281,11,1,0,3,64,64,sandman353,white,1301,-6,4,1,2,119,50,profVangi,Rated Rapid game,https://lichess.org/HwV6aLm7,2023.11.09,,profVangi,sandman353,0-1,1. e4 e5 2. d4 exd4 3. Qxd4 c5 4. Qd3 Nc6 5. Nc3 Nf6 6. Nd5 d6 7. Bg5 Be7 8. Nf3 O-O 9. O-O-O Nxd5 10. Qxd5 Bxg5+ 11. Nxg5 Be6 12. Nxe6 fxe6 13. Qxe6+ Kh8 14. Rxd6 Qg5+ 15. Rd2 Nd4 16. f3 Nxe6 17. Bc4 Nd4 18. g4 Nxf3 19. h4 Qxd2+,19,e4,e5,d4,exd4,Qxd4,c5,Qd3,Nc6,Nc3,Nf6,Nd5,d6,Bg5,Be7,Nf3,O-O,O-O-O,Nxd5,Qxd5,Bxg5+,Qxd2+,TRUE,2,1,5,1,4,3,3,2,7,1,2,1,5,3,12,2,6,4
LRSQADnO,TRUE,0,Placebo,FALSE,TRUE,standard,rapid,rapid,1699540615664,1699541017110,resign,"{'white': {'user': {'name': 'sandman353', 'id': 'sandman353'}, 'rating': 1223, 'ratingDiff': 17, 'analysis': {'inaccuracy': 2, 'mistake': 2, 'blunder': 3, 'acpl': 49, 'accuracy': 85}}, 'black': {'user': {'name': 'MJA2004', 'id': 'mja2004'}, 'rating': 1239, 'ratingDiff': -5, 'analysis': {'inaccuracy': 4, 'mistake': 3, 'blunder': 6, 'acpl': 74, 'accuracy': 80}}}",white,Nc3 d5 Nf3 Nf6 d3 c6 Bg5 Bg4 Bxf6 Bxf3 exf3 exf6 Qe2+ Qe7 Qxe7+ Bxe7 O-O-O Nd7 Re1 g6 d4 f5 Bd3 Nf8 Re2 Ne6 Rhe1 O-O-O g4 fxg4 fxg4 Rhe8 f4 Rd7 f5 Nxd4 Re3 Bg5 Kd2 Bxe3+ Rxe3 Rxe3 Kxe3 Nb5 Nxb5 cxb5 Bxb5 Re7+ Kd4 a6 Bd3 gxf5 Bxf5+ Kc7 Bxh7 f5 Bxf5 Kd6 h4 Re2 h5 Rd2+ Kc3 Rf2 h6 Ke7 h7 Kf8 h8=Q+ Kf7 Qh7+ Kf6 Qg6+ Ke5 Qe6+ Kf4 Qxd5 Rf3+ Kd2 Rf2+ Ke1 Rf3 Qe4+ Kg3 Qe5+ Kg2 Be4,"[{'eval': -13}, {'eval': 0}, {'eval': -25}, {'eval': -23}, {'eval': -66}, {'eval': -16}, {'eval': -60}, {'eval': -11}, {'eval': -60}, {'eval': -3, 'best': 'g7f6', 'variation': 'gxf6', 'judgment': {'name': 'Inaccuracy', 'comment': 'Inaccuracy. gxf6 was best.'}}, {'eval': -31}, {'eval': -46}, {'eval': -50}, {'eval': -7}, {'eval': -3}, {'eval': -20}, {'eval': -33}, {'eval': -35}, {'eval': -48}, {'eval': -53}, {'eval': -54}, {'eval': -45}, {'eval': -42}, {'eval': -42}, {'eval': -265, 'best': 'c3e2', 'variation': 'Ne2', 'judgment': {'name': 'Blunder', 'comment': 'Blunder. Ne2 was best.'}}, {'eval': -252}, {'eval': -259}, {'eval': -215}, {'eval': -439, 'best': 'e2e6', 'variation': 'Rxe6 fxe6 Rxe6 Rhe8 Kd1 Bd6 Rxe8 Rxe8 Ne2 f4 a4 Kc7 c3 Rb8', 'judgment': {'name': 'Mistake', 'comment': 'Mistake. Rxe6 was best.'}}, {'eval': -449}, {'eval': -463}, {'eval': -204, 'best': 'e7g5', 'variation': 'Bg5+ f4 Nxf4 Kb1 Nxe2 Nxe2 Rd6 Ng1 Rf6 c3 Kb8 Nh3 Bh4 Re3', 'judgment': {'name': 'Blunder', 'comment': 'Blunder. Bg5+ was best.'}}, {'eval': -235}, {'eval': -57, 'best': 'e7h4', 'variation': 'Bh4 Rf1 Nxd4 Rxe8 Rxe8 Kd2 Re1 Rxe1 Nf3+ Ke3 Nxe1 Ne2 Kd7 Nc1', 'judgment': {'name': 'Blunder', 'comment': 'Blunder. Bh4 was best.'}}, {'eval': -56}, {'eval': -57}, {'eval': -584, 'best': 'f5f6', 'variation': 'f6 Nxe2+', 'judgment': {'name': 'Blunder', 'comment': 'Blunder. f6 was best.'}}, {'eval': -588}, {'eval': -683}, {'eval': -534}, {'eval': -526}, {'eval': -536}, {'eval': -532}, {'eval': -330, 'best': 'd4f5', 'variation': 'Nxf5+ gxf5 d4+ Kf4 dxc3 bxc3 Kd8 Kg5 gxf5 Bxf5 Rd5 Kf6 Ke8 h3', 'judgment': {'name': 'Mistake', 'comment': 'Mistake. Nxf5+ was best.'}}, {'eval': -330}, {'eval': -320}, {'eval': -459, 'best': 'e3f4', 'variation': 'Kf4 Rd6 h4 Kd8 fxg6 hxg6 Kg5 Ke7 h5 gxh5 gxh5 b4 h6 Kf8', 'judgment': {'name': 'Inaccuracy', 'comment': 'Inaccuracy. Kf4 was best.'}}, {'eval': -454}, {'eval': -507}, {'eval': -287, 'best': 'e7e4', 'variation': 'Re4+ Kxd5 Rxg4 Bd3 Rh4 Ke5 Rxh2 a4 Kc7 a5 gxf5 Kxf5 Rf2+ Kg4', 'judgment': {'name': 'Mistake', 'comment': 'Mistake. Re4+ was best.'}}, {'eval': -282}, {'eval': -61, 'best': 'e7e1', 'variation': 'Re1 Kxd5 Kd8 Be4 b5 f6 h5 gxh5 gxh5 h3 Re2 Ke5 Rh2 Bf5', 'judgment': {'name': 'Blunder', 'comment': 'Blunder. Re1 was best.'}}, {'eval': -64}, {'eval': -51}, {'eval': -51}, {'eval': 55, 'best': 'e7e8', 'variation': 'Re8 Kxd5', 'judgment': {'name': 'Inaccuracy', 'comment': 'Inaccuracy. Re8 was best.'}}, {'eval': 40}, {'eval': 48}, {'eval': 72}, {'eval': 81}, {'eval': 60}, {'eval': 350, 'best': 'e2h2', 'variation': 'Rh2', 'judgment': {'name': 'Blunder', 'comment': 'Blunder. Rh2 was best.'}}, {'eval': 52, 'best': 'd4e3', 'variation': 'Ke3 Rg2 Kf4 Ke7 Ke5 Rd2 h6 Rh2 g5 Rh5 Kf4 Rh1 Bd3 Ke6', 'judgment': {'name': 'Blunder', 'comment': 'Blunder. Ke3 was best.'}}, {'eval': 312, 'best': 'd2h2', 'variation': 'Rh2 Kd4', 'judgment': {'name': 'Blunder', 'comment': 'Blunder. Rh2 was best.'}}, {'eval': 315}, {'eval': 343}, {'eval': 330}, {'mate': 47, 'best': 'f2h2', 'variation': 'Rh2 Kd4', 'judgment': {'name': 'Blunder', 'comment': 'Checkmate is now unavoidable. Rh2 was best.'}}, {'mate': 23}, {'eval': 4055}, {'eval': 9227}, {'mate': 10, 'best': 'f7f8', 'variation': 'Kf8 Qh6+', 'judgment': {'name': 'Inaccuracy', 'comment': 'Checkmate is now unavoidable. Kf8 was best.'}}, {'eval': 742, 'best': 'h7h4', 'variation': 'Qh4+ Ke5 Qxf2 b6 Qd4+ Kd6 Qxb6+ Ke7 Qxa6 d4+ Kxd4 Ke8 Qa7 Kf8', 'judgment': {'name': 'Mistake', 'comment': 'Lost forced checkmate sequence. Qh4+ was best.'}}, {'eval': 719}, {'eval': 731}, {'eval': 747}, {'eval': 741}, {'eval': 786}, {'eval': 788}, {'mate': 10, 'best': 'f4g3', 'variation': 'Kg3 Qxb7 a5 g5 Rxf5 g6 Rg5 Qe4 Rg4 Qe3+ Kh4 Qh6+ Kg3', 'judgment': {'name': 'Mistake', 'comment': 'Checkmate is now unavoidable. Kg3 was best.'}}, {'mate': 9}, {'mate': 9}, {'mate': 8}, {'mate': 8}, {'eval': 4481, 'best': 'g4g5', 'variation': 'g5 Rf4 Qe5 a5 g6 Kf3 g7 Rxf5 Qxf5+ Ke3 g8=Q Kd4 Qgg4+ Ke3', 'judgment': {'name': 'Inaccuracy', 'comment': 'Lost forced checkmate sequence. g5 was best.'}}, {'mate': 5, 'best': 'g3h4', 'variation': 'Kh4 Qf6+ Kg3 g5 Re3+ Kd2 Rf3 g6 Rf2+ Ke1 Rg2 Qe5+ Kh4 Qe4+', 'judgment': {'name': 'Inaccuracy', 'comment': 'Checkmate is now unavoidable. Kh4 was best.'}}, {'mate': 4}]","{'initial': 600, 'increment': 0, 'totalTime': 600}",1223,17,2,2,3,49,85,sandman353,1239,-5,4,3,6,74,80,MJA2004,black,1239,-5,4,3,6,74,80,MJA2004,Rated Rapid game,https://lichess.org/LRSQADnO,2023.11.09,,sandman353,MJA2004,1-0,1. Nc3 d5 2. Nf3 Nf6 3. d3 c6 4. Bg5 Bg4 5. Bxf6 Bxf3 6. exf3 exf6 7. Qe2+ Qe7 8. Qxe7+ Bxe7 9. O-O-O Nd7 10. Re1 g6 11. d4 f5 12. Bd3 Nf8 13. Re2 Ne6 14. Rhe1 O-O-O 15. g4 fxg4 16. fxg4 Rhe8 17. f4 Rd7 18. f5 Nxd4 19. Re3 Bg5 20. Kd2 Bxe3+ 21. Rxe3 Rxe3 22. Kxe3 Nb5 23. Nxb5 cxb5 24. Bxb5 Re7+ 25. Kd4 a6 26. Bd3 gxf5 27. Bxf5+ Kc7 28. Bxh7 f5 29. Bxf5 Kd6 30. h4 Re2 31. h5 Rd2+ 32. Kc3 Rf2 33. h6 Ke7 34. h7 Kf8 35. h8=Q+ Kf7 36. Qh7+ Kf6 37. Qg6+ Ke5 38. Qe6+ Kf4 39. Qxd5 Rf3+ 40. Kd2 Rf2+ 41. Ke1 Rf3 42. Qe4+ Kg3 43. Qe5+ Kg2 44. Be4,44,Nc3,d5,Nf3,Nf6,d3,c6,Bg5,Bg4,Bxf6,Bxf3,exf3,exf6,Qe2+,Qe7,Qxe7+,Bxe7,O-O-O,Nd7,Re1,g6,Be4,TRUE,9,7,3,1,8,6,5,11,6,1,1,11,14,18,9,2,9,17
N8kJdwLj,TRUE,0,Placebo,FALSE,TRUE,standard,rapid,rapid,1699901373547,1699902116811,mate,"{'white': {'user': {'name': 'sandman353', 'id': 'sandman353'}, 'rating': 1359, 'ratingDiff': -9, 'analysis': {'inaccuracy': 7, 'mistake': 2, 'blunder': 3, 'acpl': 48, 'accuracy': 80}}, 'black': {'user': {'name': 'Triex', 'id': 'triex'}, 'rating': 1300, 'ratingDiff': 12, 'analysis': {'inaccuracy': 6, 'mistake': 2, 'blunder': 4, 'acpl': 38, 'accuracy': 88}}}",black,Nc3 e5 Nf3 Nc6 d4 d6 Bg5 Nf6 e4 Be7 Bb5 O-O O-O a6 Bxc6 bxc6 dxe5 dxe5 Nxe5 Qxd1 Raxd1 Nxe4 Bxe7 Nxc3 Bxf8 Nxd1 Rxd1 f6 Rd8 fxe5 Bc5+ Kf7 Rf8+ Ke6 Re8+ Kd5 Be3 Bb7 Re7 c5 Rxc7 Bc6 Rxg7 Rb8 Rxh7 Rxb2 h3 Rxc2 a3 Ra2 Bc1 Ra1 Kh2 Rxc1 Ra7 Bb5 h4 Ra1 h5 Rxa3 h6 Bd3 h7 Bxh7 Rxh7 c4 Rd7+ Kc5 Rc7+ Kd4 Rd7+ Kc5 Rc7+ Kb4 Rb7+ Ka4 Rc7 c3 Rc4+ Kb3 Re4 Ra5 Re1 c2 Rc1 Kb2 Re1 c1=Q Rxc1 Kxc1 g4 e4 Kg3 Kd2 Kf4 Ke2 g5 Kxf2 g6 Rd5 Kxe4 Rd8 Kf5 a5 Kf6 a4 g7 a3 Kf7 a2 g8=Q Rxg8 Kxg8 a1=Q Kf7 Qa6 Ke7 Ke3 Kd7 Kd4 Ke7 Ke5 Kd7 Kd5 Kc7 Ke6 Kd8 Qb6+ Ke8 Qb8#,"[{'eval': -13}, {'eval': 38}, {'eval': 39}, {'eval': 18}, {'eval': 40}, {'eval': 79}, {'eval': 13, 'best': 'e2e4', 'variation': 'e4 exd4 Nxd4 Be7 Bb5 Bd7 Nxc6 bxc6 Bd3 Bf6', 'judgment': {'name': 'Inaccuracy', 'comment': 'Inaccuracy. e4 was best.'}}, {'eval': 110, 'best': 'f7f6', 'variation': 'f6 Be3 Bd7 d5 Nce7 Bd2 f5 e4 Nf6 exf5', 'judgment': {'name': 'Inaccuracy', 'comment': 'Inaccuracy. f6 was best.'}}, {'eval': 36, 'best': 'd4e5', 'variation': 'dxe5 Nxe5 Nxe5 dxe5 Qxd8+ Kxd8 O-O-O+ Bd6 Nd5 h6', 'judgment': {'name': 'Inaccuracy', 'comment': 'Inaccuracy. dxe5 was best.'}}, {'eval': 48}, {'eval': -9, 'best': 'd4e5', 'variation': 'dxe5 Nxe5 Nxe5 dxe5 Qxd8+ Bxd8 Bc4 h6 Be3 c6', 'judgment': {'name': 'Inaccuracy', 'comment': 'Inaccuracy. dxe5 was best.'}}, {'eval': 209, 'best': 'e5d4', 'variation': 'exd4 Nxd4 Bd7 Bf4 O-O O-O Nxd4 Qxd4 Nh5 Bd2', 'judgment': {'name': 'Blunder', 'comment': 'Blunder. exd4 was best.'}}, {'eval': 12, 'best': 'b5c6', 'variation': 'Bxc6 bxc6 dxe5 dxe5 Qxd8 Bxd8 Nxe5 Nxe4 Nxe4 f6', 'judgment': {'name': 'Blunder', 'comment': 'Blunder. Bxc6 was best.'}}, {'eval': 195, 'best': 'e5d4', 'variation': 'exd4 Nxd4 Nxd4 Qxd4 c6 Be2 Re8 Rfe1 Be6 Rad1', 'judgment': {'name': 'Blunder', 'comment': 'Blunder. exd4 was best.'}}, {'eval': 193}, {'eval': 194}, {'eval': 188}, {'eval': 198}, {'eval': 203}, {'eval': 230}, {'eval': 231}, {'eval': 495, 'best': 'e7b4', 'variation': 'Bb4 f3 Bxc3 bxc3 c5 Nd3 Nd7 Bf4 Ra7 Rd2 Re8 Rfd1 f6 Be3', 'judgment': {'name': 'Blunder', 'comment': 'Blunder. Bb4 was best.'}}, {'eval': 471}, {'eval': 500}, {'eval': 443}, {'eval': 451}, {'eval': 277, 'best': 'f8a3', 'variation': 'Ba3 Nxb2 Bxb2 c5 Nc4 f6 Re1 Rb8 Bc3 Kf7 a3 Be6 Ne3 Rb6', 'judgment': {'name': 'Mistake', 'comment': 'Mistake. Ba3 was best.'}}, {'eval': 385, 'best': 'g8f8', 'variation': 'Kxf8 Rd8+ Ke7 Nxc6+ Ke6 Nb4 c5 Nd5 Rb8 b3 c4 f3 cxb3 axb3', 'judgment': {'name': 'Inaccuracy', 'comment': 'Inaccuracy. Kxf8 was best.'}}, {'eval': 373}, {'eval': 375}, {'eval': 249, 'best': 'f8d6', 'variation': 'Bd6+ Kf7 Bxe5 c5 Bxc7 a5 f3 a4 Bd6 a3 bxa3 Bb7 Rxa8 Bxa8', 'judgment': {'name': 'Inaccuracy', 'comment': 'Inaccuracy. Bd6+ was best.'}}, {'eval': 266}, {'eval': 229}, {'eval': 236}, {'eval': 207}, {'eval': 262}, {'eval': 206}, {'eval': 213}, {'eval': 188}, {'eval': 344, 'best': 'b7c8', 'variation': 'Bc8 h3 Bf5 c4+ Kxc4 Rxe5 Bd3 Rc5+ Kb4 Rxc6 Rc8 Rc3 Bb1 a3+', 'judgment': {'name': 'Mistake', 'comment': 'Mistake. Bc8 was best.'}}, {'eval': 340}, {'eval': 347}, {'eval': 342}, {'eval': 360}, {'eval': 342}, {'eval': 291}, {'eval': 227}, {'eval': 230}, {'eval': 0, 'best': 'h3h4', 'variation': 'h4 Rxa2 h5 Rb2 h6 Rb8 Kh2 c4 g4 c3 g5 Ke6 Rc7 Bd5', 'judgment': {'name': 'Blunder', 'comment': 'Blunder. h4 was best.'}}, {'eval': 231, 'best': 'c5c4', 'variation': 'c4 Rh8 c3 Rd8+ Kc4 Rc8 Kd5', 'judgment': {'name': 'Blunder', 'comment': 'Blunder. c4 was best.'}}, {'eval': -488, 'best': 'h3h4', 'variation': 'h4', 'judgment': {'name': 'Blunder', 'comment': 'Blunder. h4 was best.'}}, {'eval': -523}, {'eval': -504}, {'eval': -519}, {'eval': -567}, {'eval': -413, 'best': 'c5c4', 'variation': 'c4 Rf7 Rb1 Rf8 e4 Rd8+ Kc5 Rd2 Ba4 Re2 Bb3 h4 c3 h5', 'judgment': {'name': 'Inaccuracy', 'comment': 'Inaccuracy. c4 was best.'}}, {'eval': -426}, {'eval': -318, 'best': 'c1c4', 'variation': 'Rc4 Kg3 Rf4 Ra8 Rf7 Rd8+ Bd7 f3 c4 Kf2 c3 Ke3 Kc4 Rb8', 'judgment': {'name': 'Inaccuracy', 'comment': 'Inaccuracy. Rc4 was best.'}}, {'eval': -335}, {'eval': -300}, {'eval': -293}, {'eval': -294}, {'eval': -296}, {'eval': -291}, {'eval': -327}, {'eval': -344}, {'eval': -426}, {'eval': -322, 'best': 'd5c6', 'variation': 'Kc6 Rd8 Rd3 Re8 c3 Rc8+ Kb5 g4 Kb4 g5 Kb3 Rc6 c2 g6', 'judgment': {'name': 'Inaccuracy', 'comment': 'Inaccuracy. Kc6 was best.'}}, {'eval': -340}, {'eval': -344}, {'eval': -380}, {'eval': -302}, {'eval': -293}, {'eval': -349}, {'eval': -456, 'best': 'g2g4', 'variation': 'g4 Rf3', 'judgment': {'name': 'Inaccuracy', 'comment': 'Inaccuracy. g4 was best.'}}, {'eval': -386}, {'eval': -386}, {'eval': -400}, {'eval': -594, 'best': 'g2g4', 'variation': 'g4 Kb3 g5 Ra4 Kg3 c2 g6 Rd4 g7 Rd8 Kh4 Kb2 Rb7+ Kc3', 'judgment': {'name': 'Inaccuracy', 'comment': 'Inaccuracy. g4 was best.'}}, {'eval': -581}, {'eval': -606}, {'eval': -640}, {'eval': -644}, {'eval': -660}, {'eval': -722}, {'eval': -716}, {'eval': -689}, {'eval': -887}, {'eval': -1008}, {'eval': -998}, {'eval': -950}, {'eval': -910}, {'eval': -968}, {'eval': -1649}, {'eval': -1634}, {'eval': -1001}, {'eval': -1716}, {'eval': -1344}, {'eval': -1524}, {'eval': -1493}, {'mate': -23, 'best': 'g6g7', 'variation': 'g7 Rd8 Kxe4 Rg8 Kd3 Rxg7 Kc2 Ke3 Kc3 Rg8 Kb4 Kd3 Ka5 Rg6', 'judgment': {'name': 'Inaccuracy', 'comment': 'Checkmate is now unavoidable. g7 was best.'}}, {'eval': -938, 'best': 'd5g5', 'variation': 'Rg5 g7 Rxg7 Kd3 Rg5 Kd4 Rb5 Kd3 a5 Kc4 Rb1 Kd3 a4 Kc2', 'judgment': {'name': 'Mistake', 'comment': 'Lost forced checkmate sequence. Rg5 was best.'}}, {'eval': -1006}, {'eval': -936}, {'eval': -939}, {'eval': -778}, {'mate': -42, 'best': 'f6f7', 'variation': 'Kf7 a3 g7 Kf3 g8=Q Rxg8 Kxg8 Kg4 Kf8 Kf5 Ke7 Ke5 Kf7 Kd6', 'judgment': {'name': 'Mistake', 'comment': 'Checkmate is now unavoidable. Kf7 was best.'}}, {'eval': -1356, 'best': 'd8b8', 'variation': 'Rb8 Kf7 Kf3 g8=Q Rxg8 Kxg8 Ke4 Kf8 Ke5 Kf7 Kd6 Kf6 a3 Kg6', 'judgment': {'name': 'Inaccuracy', 'comment': 'Lost forced checkmate sequence. Rb8 was best.'}}, {'eval': -1591}, {'mate': -14}, {'mate': -12}, {'mate': -26}, {'mate': -13}, {'mate': -7}, {'mate': -7}, {'mate': -7}, {'mate': -7}, {'mate': -7}, {'mate': -6}, {'mate': -5}, {'mate': -6}, {'mate': -4}, {'mate': -3}, {'mate': -4}, {'mate': -3}, {'mate': -4}, {'mate': -2}, {'mate': -2}, {'mate': -1}]","{'initial': 600, 'increment': 0, 'totalTime': 600}",1359,-9,7,2,3,48,80,sandman353,1300,12,6,2,4,38,88,Triex,black,1300,12,6,2,4,38,88,Triex,Rated Rapid game,https://lichess.org/N8kJdwLj,2023.11.13,,sandman353,Triex,0-1,1. Nc3 e5 2. Nf3 Nc6 3. d4 d6 4. Bg5 Nf6 5. e4 Be7 6. Bb5 O-O 7. O-O a6 8. Bxc6 bxc6 9. dxe5 dxe5 10. Nxe5 Qxd1 11. Raxd1 Nxe4 12. Bxe7 Nxc3 13. Bxf8 Nxd1 14. Rxd1 f6 15. Rd8 fxe5 16. Bc5+ Kf7 17. Rf8+ Ke6 18. Re8+ Kd5 19. Be3 Bb7 20. Re7 c5 21. Rxc7 Bc6 22. Rxg7 Rb8 23. Rxh7 Rxb2 24. h3 Rxc2 25. a3 Ra2 26. Bc1 Ra1 27. Kh2 Rxc1 28. Ra7 Bb5 29. h4 Ra1 30. h5 Rxa3 31. h6 Bd3 32. h7 Bxh7 33. Rxh7 c4 34. Rd7+ Kc5 35. Rc7+ Kd4 36. Rd7+ Kc5 37. Rc7+ Kb4 38. Rb7+ Ka4 39. Rc7 c3 40. Rc4+ Kb3 41. Re4 Ra5 42. Re1 c2 43. Rc1 Kb2 44. Re1 c1=Q 45. Rxc1 Kxc1 46. g4 e4 47. Kg3 Kd2 48. Kf4 Ke2 49. g5 Kxf2 50. g6 Rd5 51. Kxe4 Rd8 52. Kf5 a5 53. Kf6 a4 54. g7 a3 55. Kf7 a2 56. g8=Q Rxg8 57. Kxg8 a1=Q 58. Kf7 Qa6 59. Ke7 Ke3 60. Kd7 Kd4 61. Ke7 Ke5 62. Kd7 Kd5 63. Kc7 Ke6 64. Kd8 Qb6+ 65. Ke8 Qb8#,65,Nc3,e5,Nf3,Nc6,d4,d6,Bg5,Nf6,e4,Be7,Bb5,O-O,O-O,a6,Bxc6,bxc6,dxe5,dxe5,Nxe5,Qxd1,Qb8#,TRUE,8,17,3,1,0,24,6,20,5,1,4,13,14,37,8,2,4,37
OIZ2hHeQ,TRUE,0,Chatty,FALSE,TRUE,standard,rapid,rapid,1699545565511,1699546024113,resign,"{'white': {'user': {'name': 'StanOref', 'id': 'stanoref'}, 'rating': 1254, 'ratingDiff': -7, 'analysis': {'inaccuracy': 1, 'mistake': 1, 'blunder': 2, 'acpl': 73, 'accuracy': 69}}, 'black': {'user': {'name': 'sandman353', 'id': 'sandman353'}, 'rating': 1280, 'ratingDiff': 11, 'analysis': {'inaccuracy': 3, 'mistake': 0, 'blunder': 0, 'acpl': 27, 'accuracy': 89}}}",black,e4 e5 Nf3 Nc6 Bb5 a6 Ba4 Nf6 O-O Be7 Nc3 O-O Bxc6 dxc6 Nxe5 Bd6 d4 c5 Bg5 cxd4 Qxd4 c5 Qc4 Bxe5 Qxc5 Bxc3 Qxc3 h6 Rad1 Qe7 Bh4 Qxe4 Bxf6 gxf6 Qg3+ Kh7 c3 Rg8 Qc7,"[{'eval': 36}, {'eval': 35}, {'eval': 29}, {'eval': 32}, {'eval': 34}, {'eval': 38}, {'eval': 31}, {'eval': 37}, {'eval': 24}, {'eval': 36}, {'eval': 13}, {'eval': 73, 'best': 'b7b5', 'variation': 'b5 Bb3 d6 a4 b4 Nd5 Na5 Nxe7 Qxe7 Ba2', 'judgment': {'name': 'Inaccuracy', 'comment': 'Inaccuracy. b5 was best.'}}, {'eval': 76}, {'eval': 50}, {'eval': 60}, {'eval': 138, 'best': 'f6e4', 'variation': 'Nxe4', 'judgment': {'name': 'Inaccuracy', 'comment': 'Inaccuracy. Nxe4 was best.'}}, {'eval': 152}, {'eval': 177}, {'eval': -333, 'best': 'e5f3', 'variation': 'Nf3 cxd4 Qxd4 Ng4 Rd1 Qe8 Nd5 Ne5 Bf4 Nxf3+ gxf3 Bxf4 Nxf4 c6', 'judgment': {'name': 'Blunder', 'comment': 'Blunder. Nf3 was best.'}}, {'eval': -258}, {'eval': -427, 'best': 'c3d5', 'variation': 'Nd5 Bxe5 f4 Bd6 Bh4 c6 Nxf6+ gxf6 Rf3 Be7 f5 Kh8 Rg3 Rg8', 'judgment': {'name': 'Mistake', 'comment': 'Mistake. Nd5 was best.'}}, {'eval': -401}, {'eval': -398}, {'eval': -443}, {'eval': -468}, {'eval': -470}, {'eval': -501}, {'eval': -344, 'best': 'f6e4', 'variation': 'Nxe4 Bxd8', 'judgment': {'name': 'Inaccuracy', 'comment': 'Inaccuracy. Nxe4 was best.'}}, {'eval': -355}, {'eval': -358}, {'eval': -409}, {'eval': -375}, {'eval': -345}, {'eval': -368}, {'eval': -499, 'best': 'c3f6', 'variation': 'Qxf6 Kh7', 'judgment': {'name': 'Inaccuracy', 'comment': 'Inaccuracy. Qxf6 was best.'}}, {'eval': -546}, {'eval': -543}, {'eval': -517}, {'mate': -1, 'best': 'f1e1', 'variation': 'Rfe1 Qc6 Rd6 Rxg3 Rxc6 Rxg2+ Kxg2 bxc6 Re7 Be6 b3 Rd8 c4 Rd2', 'judgment': {'name': 'Blunder', 'comment': 'Checkmate is now unavoidable. Rfe1 was best.'}}]","{'initial': 600, 'increment': 0, 'totalTime': 600}",1254,-7,1,1,2,73,69,StanOref,1280,11,3,0,0,27,89,sandman353,white,1254,-7,1,1,2,73,69,StanOref,Rated Rapid game,https://lichess.org/OIZ2hHeQ,2023.11.09,,StanOref,sandman353,0-1,1. e4 e5 2. Nf3 Nc6 3. Bb5 a6 4. Ba4 Nf6 5. O-O Be7 6. Nc3 O-O 7. Bxc6 dxc6 8. Nxe5 Bd6 9. d4 c5 10. Bg5 cxd4 11. Qxd4 c5 12. Qc4 Bxe5 13. Qxc5 Bxc3 14. Qxc3 h6 15. Rad1 Qe7 16. Bh4 Qxe4 17. Bxf6 gxf6 18. Qg3+ Kh7 19. c3 Rg8 20. Qc7,20,e4,e5,Nf3,Nc6,Bb5,a6,Ba4,Nf6,O-O,Be7,Nc3,O-O,Bxc6,dxc6,Nxe5,Bd6,d4,c5,Bg5,cxd4,Qc7,TRUE,6,1,3,1,6,2,4,2,2,1,2,2,10,3,5,2,8,4
PvgrPaOx,TRUE,1,Chatty,FALSE,TRUE,standard,rapid,rapid,1699544400588,1699545020910,mate,"{'white': {'user': {'name': 'sandman353', 'id': 'sandman353'}, 'rating': 1277, 'ratingDiff': -11, 'analysis': {'inaccuracy': 3, 'mistake': 1, 'blunder': 3, 'acpl': 70, 'accuracy': 60}}, 'black': {'user': {'name': 'TGuzel-1988', 'id': 'tguzel-1988'}, 'rating': 1289, 'ratingDiff': 5, 'analysis': {'inaccuracy': 2, 'mistake': 1, 'blunder': 3, 'acpl': 48, 'accuracy': 83}}}",black,Nc3 d6 g3 c6 Bg2 e5 Nf3 Nf6 O-O Be7 d4 e4 Nd2 O-O Ndxe4 Nxe4 Nxe4 d5 Nc5 Bxc5 dxc5 Nd7 b4 Ne5 Bb2 Nc4 Qd4 Nxb2 Qxb2 Bg4 Rfe1 Qg5 b5 Rae8 bxc6 bxc6 e3 Re5 f4 Qe7 fxe5 Qxc5 h3 Bf5 Rac1 a5 g4 Be4 Bxe4 dxe4 c4 Rd8 Red1 Qxe3+ Kf1 Qf3+ Ke1 Qe3+ Qe2 Qg3+ Qf2 Rxd1+ Kxd1 Qxf2 Rc2 Qf3+ Re2 Qd3+ Rd2 Qf3+ Kc2 h6 Rd8+ Kh7 Rc8 Qd3+ Kb2 e3 Rxc6 e2 Ra6 e1=Q c5 Qdc3#,"[{'eval': -13}, {'eval': 74, 'best': 'd7d5', 'variation': 'd5 d4 Nf6 Bf4 e6 Nb5 Na6 e3 Be7 Nf3', 'judgment': {'name': 'Inaccuracy', 'comment': 'Inaccuracy. d5 was best.'}}, {'eval': 3, 'best': 'd2d4', 'variation': 'd4 d5 e4 dxe4 Nxe4 Nf6 Bd3 Nxe4 Bxe4 Nd7', 'judgment': {'name': 'Inaccuracy', 'comment': 'Inaccuracy. d4 was best.'}}, {'eval': 33}, {'eval': 35}, {'eval': 38}, {'eval': 21}, {'eval': 22}, {'eval': 23}, {'eval': 26}, {'eval': -28}, {'eval': -25}, {'eval': -28}, {'eval': 134, 'best': 'd6d5', 'variation': 'd5 f3', 'judgment': {'name': 'Mistake', 'comment': 'Mistake. d5 was best.'}}, {'eval': 130}, {'eval': 128}, {'eval': 125}, {'eval': 130}, {'eval': 115}, {'eval': 107}, {'eval': 115}, {'eval': 126}, {'eval': 105}, {'eval': 108}, {'eval': 112}, {'eval': 170}, {'eval': 97, 'best': 'b2c3', 'variation': 'Bc3', 'judgment': {'name': 'Inaccuracy', 'comment': 'Inaccuracy. Bc3 was best.'}}, {'eval': 98}, {'eval': 96}, {'eval': 92}, {'eval': 79}, {'eval': 163, 'best': 'f8e8', 'variation': 'Re8', 'judgment': {'name': 'Inaccuracy', 'comment': 'Inaccuracy. Re8 was best.'}}, {'eval': 80, 'best': 'h2h4', 'variation': 'h4', 'judgment': {'name': 'Inaccuracy', 'comment': 'Inaccuracy. h4 was best.'}}, {'eval': 75}, {'eval': 74}, {'eval': 75}, {'eval': 54}, {'eval': 565, 'best': 'h7h5', 'variation': 'h5 h4 Qf5 Rac1 Re4 Bxe4 dxe4 Qd4 Qf3 Qd1 Qxd1 Rexd1 Bxd1 Rxd1', 'judgment': {'name': 'Blunder', 'comment': 'Blunder. h5 was best.'}}, {'eval': 566}, {'eval': 567}, {'eval': 575}, {'eval': 582}, {'eval': 528}, {'eval': 528}, {'eval': 519}, {'eval': 535}, {'eval': 513}, {'eval': 527}, {'eval': 522}, {'eval': 543}, {'eval': 524}, {'eval': 533}, {'eval': 556}, {'eval': 540}, {'eval': 0, 'best': 'b2f2', 'variation': 'Qf2 Qg5 Qf4 Qe7 Rxd8+ Qxd8 Rf1 f6 exf6 Qxf6 Qxf6 gxf6 Rxf6 a4', 'judgment': {'name': 'Blunder', 'comment': 'Blunder. Qf2 was best.'}}, {'eval': 0}, {'eval': 0}, {'eval': 0}, {'eval': 0}, {'eval': 514, 'best': 'e3g1', 'variation': 'Qg1+ Qf1 Qe3+ Qe2', 'judgment': {'name': 'Blunder', 'comment': 'Blunder. Qg1+ was best.'}}, {'eval': 485}, {'eval': 493}, {'eval': -655, 'best': 'c1d1', 'variation': 'Rxd1 Qc3+ Kf1 Qxh3+ Qg2 Qh4 Qg3 Qg5 e6 Qf6+ Qf2 fxe6 Qxf6 gxf6', 'judgment': {'name': 'Blunder', 'comment': 'Blunder. Rxd1 was best.'}}, {'eval': -668}, {'eval': -650}, {'eval': -681}, {'mate': -11, 'best': 'd1e1', 'variation': 'Ke1 e3 a4 h6 Rb2 h5 Rh2 Kh7 Rd2 Qxh3 Ke2 Qg3 Kd3 e2+', 'judgment': {'name': 'Blunder', 'comment': 'Checkmate is now unavoidable. Ke1 was best.'}}, {'eval': -630, 'best': 'e4e3', 'variation': 'e3 e6 Qf1+ Re1 Qd3+ Kc1 Qc3+ Kb1 Qxe1+ Kc2 Qd2+ Kb3 e2 e7', 'judgment': {'name': 'Blunder', 'comment': 'Lost forced checkmate sequence. e3 was best.'}}, {'eval': -668}, {'eval': -638}, {'eval': -641}, {'eval': -656}, {'eval': -701}, {'eval': -702}, {'mate': -13, 'best': 'e5e6', 'variation': 'e6 fxe6 Rd1 Qe2+ Rd2 Qxc4+ Kd1 e3 Rd6 Qxa2 g5 Qb1+ Ke2 Qc2+', 'judgment': {'name': 'Mistake', 'comment': 'Checkmate is now unavoidable. e6 was best.'}}, {'mate': -10}, {'mate': -10}, {'mate': -9}, {'mate': -6}, {'mate': -5}, {'mate': -3}, {'mate': -2}, {'mate': -1}]","{'initial': 600, 'increment': 0, 'totalTime': 600}",1277,-11,3,1,3,70,60,sandman353,1289,5,2,1,3,48,83,TGuzel-1988,black,1289,5,2,1,3,48,83,TGuzel-1988,Rated Rapid game,https://lichess.org/PvgrPaOx,2023.11.09,,sandman353,TGuzel-1988,0-1,1. Nc3 d6 2. g3 c6 3. Bg2 e5 4. Nf3 Nf6 5. O-O Be7 6. d4 e4 7. Nd2 O-O 8. Ndxe4 Nxe4 9. Nxe4 d5 10. Nc5 Bxc5 11. dxc5 Nd7 12. b4 Ne5 13. Bb2 Nc4 14. Qd4 Nxb2 15. Qxb2 Bg4 16. Rfe1 Qg5 17. b5 Rae8 18. bxc6 bxc6 19. e3 Re5 20. f4 Qe7 21. fxe5 Qxc5 22. h3 Bf5 23. Rac1 a5 24. g4 Be4 25. Bxe4 dxe4 26. c4 Rd8 27. Red1 Qxe3+ 28. Kf1 Qf3+ 29. Ke1 Qe3+ 30. Qe2 Qg3+ 31. Qf2 Rxd1+ 32. Kxd1 Qxf2 33. Rc2 Qf3+ 34. Re2 Qd3+ 35. Rd2 Qf3+ 36. Kc2 h6 37. Rd8+ Kh7 38. Rc8 Qd3+ 39. Kb2 e3 40. Rxc6 e2 41. Ra6 e1=Q 42. c5 Qdc3#,42,Nc3,d6,g3,c6,Bg2,e5,Nf3,Nf6,O-O,Be7,d4,e4,Nd2,O-O,Ndxe4,Nxe4,Nxe4,d5,Nc5,Bxc5,Qdc3#,TRUE,3,6,6,1,4,11,5,2,6,1,13,5,8,8,12,2,17,16
