game_id,rated.x,treat_type,chat_type,opp_respond,rated.y,variant,speed,perf,createdAt,lastMoveAt,status,players,winner,moves,analysis,clock,white_rating,white_ratingDiff,white_inaccuracy,white_mistake,white_blunder,white_acpl,white_accuracy,white_player,black_rating,black_ratingDiff,black_inaccuracy,black_mistake,black_blunder,black_acpl,black_accuracy,black_player,opponent_color,op_rating,op_ratingDiff,op_inaccuracy,op_mistake,op_blunder,op_acpl,op_accuracy,op_player,Event,Site,Date,Round,White,Black,Result,Movetext,NMoves,W1,B1,W2,B2,W3,B3,W4,B4,W5,B5,W6,B6,W7,B7,W8,B8,W9,B9,W10,B10,last.move,complete.movetext,W_B_moves,W_K_moves,W_N_moves,W_O_moves,W_Q_moves,W_R_moves,B_B_moves,B_K_moves,B_N_moves,B_O_moves,B_Q_moves,B_R_moves,B_moves,K_moves,N_moves,O_moves,Q_moves,R_moves
QU1XYSzI,TRUE,0,Placebo,FALSE,TRUE,standard,rapid,rapid,1699629531783,1699630051164,resign,"{'white': {'user': {'name': 'Bakirovgamir', 'id': 'bakirovgamir'}, 'rating': 1368, 'ratingDiff': -6, 'analysis': {'inaccuracy': 1, 'mistake': 1, 'blunder': 3, 'acpl': 50, 'accuracy': 85}}, 'black': {'user': {'name': 'sandman353', 'id': 'sandman353'}, 'rating': 1323, 'ratingDiff': 9, 'analysis': {'inaccuracy': 3, 'mistake': 2, 'blunder': 0, 'acpl': 26, 'accuracy': 93}}}",black,e4 e5 Nf3 Nc6 Bc4 Nf6 Nc3 Bb4 O-O O-O d3 d6 Nd5 Nxd5 exd5 Nd4 c3 Nxf3+ Qxf3 Bc5 Be3 Bxe3 fxe3 c6 a3 cxd5 Bxd5 Be6 c4 Bxd5 cxd5 Qb6 b4 Rac8 Qg4 Qxe3+ Rf2 Rc1+ Rxc1 Qxc1+ Rf1 Qxa3 h3 Qxd3 Rd1 Qe3+ Kh2 f5 Qh4 f4 Re1 Qd2 b5 f3 Rg1 fxg2 Rxg2 Qf4+ Qg3 Qxg3+ Rxg3 Rf2+ Kg1 Rb2 Ra3 Rxb5 Rxa7 Rxd5 Rxb7 e4 Re7 Re5 Rd7 e3 Rd8+ Kf7 Rxd6 e2 Rd7+ Ke6,"[{'eval': 36}, {'eval': 35}, {'eval': 29}, {'eval': 32}, {'eval': 21}, {'eval': 29}, {'eval': 0}, {'eval': 50}, {'eval': 24}, {'eval': 40}, {'eval': 11}, {'eval': 44}, {'eval': 17}, {'eval': 28}, {'eval': -3}, {'eval': 12}, {'eval': -24}, {'eval': -18}, {'eval': -18}, {'eval': -18}, {'eval': -24}, {'eval': -20}, {'eval': -34}, {'eval': 119, 'best': 'd8g5', 'variation': 'Qg5 d4', 'judgment': {'name': 'Mistake', 'comment': 'Mistake. Qg5 was best.'}}, {'eval': -41, 'best': 'd5c6', 'variation': 'dxc6 Qc7 cxb7 Bxb7 e4 Ba6 Bb3 Bc8 h3 h6 Kh2 a5 Bd5 Rb8', 'judgment': {'name': 'Mistake', 'comment': 'Mistake. dxc6 was best.'}}, {'eval': 24, 'best': 'b7b5', 'variation': 'b5 Bb3 c5 a4 b4 cxb4 cxb4 a5 f5 Qf2 h5 h3 Qg5 Kh2', 'judgment': {'name': 'Inaccuracy', 'comment': 'Inaccuracy. b5 was best.'}}, {'eval': 33}, {'eval': 171, 'best': 'd8e7', 'variation': 'Qe7 Rf2', 'judgment': {'name': 'Mistake', 'comment': 'Mistake. Qe7 was best.'}}, {'eval': 1, 'best': 'd5e6', 'variation': 'Bxe6 fxe6 Qxb7 Qg5 Rf3 Rxf3 Qxf3 d5 Rf1 h6 h4 Qg6 e4 Rd8', 'judgment': {'name': 'Blunder', 'comment': 'Blunder. Bxe6 was best.'}}, {'eval': 5}, {'eval': -45}, {'eval': -50}, {'eval': -46}, {'eval': -50}, {'eval': -357, 'best': 'a1c1', 'variation': 'Rac1', 'judgment': {'name': 'Blunder', 'comment': 'Blunder. Rac1 was best.'}}, {'eval': -351}, {'eval': -429}, {'eval': -441}, {'eval': -441}, {'eval': -439}, {'eval': -433}, {'eval': -321, 'best': 'c1e3', 'variation': 'Qe3+ Rf2 Qxd3 h4 Qxd5 Rc2 f5 Qe2 h6 Rc7 Rf7 Qc2 Kh7 Rxf7', 'judgment': {'name': 'Inaccuracy', 'comment': 'Inaccuracy. Qe3+ was best.'}}, {'eval': -474, 'best': 'g4c4', 'variation': 'Qc4 a6 Rc1 b5 Qc3 Qa2 Qc6 Qd2 Qc3 Qe3+ Kh1 e4 dxe4 Qxe4', 'judgment': {'name': 'Inaccuracy', 'comment': 'Inaccuracy. Qc4 was best.'}}, {'eval': -497}, {'eval': -490}, {'eval': -471}, {'eval': -490}, {'eval': -485}, {'eval': -506}, {'eval': -499}, {'eval': -524}, {'eval': -528}, {'eval': -674}, {'eval': -620}, {'eval': -697}, {'eval': -517, 'best': 'f3f2', 'variation': 'f2 Rh1 f1=Q Rxf1 Rxf1 Qd8+ Rf8 Qxd6 Qf4+ Kg1 e4 Qxf4 Rxf4 d6', 'judgment': {'name': 'Inaccuracy', 'comment': 'Inaccuracy. f2 was best.'}}, {'eval': -496}, {'eval': -439}, {'eval': -508}, {'eval': -495}, {'eval': -549}, {'eval': -545}, {'eval': -546}, {'eval': -560}, {'eval': -570}, {'eval': -569}, {'eval': -574}, {'eval': -554}, {'eval': -564}, {'eval': -530}, {'eval': -524}, {'eval': -538}, {'eval': -502}, {'eval': -581}, {'eval': -552}, {'eval': -551}, {'mate': -7, 'best': 'g1f1', 'variation': 'Kf1 Ke6 Ke2 g6 Rh8 h5 Rg8 Kf6 Ra8 Kg5 Ra4 d5 Rb4 Kf5', 'judgment': {'name': 'Blunder', 'comment': 'Checkmate is now unavoidable. Kf1 was best.'}}, {'mate': -6}, {'mate': -6}, {'mate': -7}]","{'initial': 600, 'increment': 0, 'totalTime': 600}",1368,-6,1,1,3,50,85,Bakirovgamir,1323,9,3,2,0,26,93,sandman353,white,1368,-6,1,1,3,50,85,Bakirovgamir,Rated Rapid game,https://lichess.org/QU1XYSzI,2023.11.10,,Bakirovgamir,sandman353,0-1,1. e4 e5 2. Nf3 Nc6 3. Bc4 Nf6 4. Nc3 Bb4 5. O-O O-O 6. d3 d6 7. Nd5 Nxd5 8. exd5 Nd4 9. c3 Nxf3+ 10. Qxf3 Bc5 11. Be3 Bxe3 12. fxe3 c6 13. a3 cxd5 14. Bxd5 Be6 15. c4 Bxd5 16. cxd5 Qb6 17. b4 Rac8 18. Qg4 Qxe3+ 19. Rf2 Rc1+ 20. Rxc1 Qxc1+ 21. Rf1 Qxa3 22. h3 Qxd3 23. Rd1 Qe3+ 24. Kh2 f5 25. Qh4 f4 26. Re1 Qd2 27. b5 f3 28. Rg1 fxg2 29. Rxg2 Qf4+ 30. Qg3 Qxg3+ 31. Rxg3 Rf2+ 32. Kg1 Rb2 33. Ra3 Rxb5 34. Rxa7 Rxd5 35. Rxb7 e4 36. Re7 Re5 37. Rd7 e3 38. Rd8+ Kf7 39. Rxd6 e2 40. Rd7+ Ke6,40,e4,e5,Nf3,Nc6,Bc4,Nf6,Nc3,Bb4,O-O,O-O,d3,d6,Nd5,Nxd5,exd5,Nd4,c3,Nxf3+,Qxf3,Bc5,Ke6,TRUE,3,3,3,1,4,17,5,3,5,1,9,8,8,6,8,2,13,25
U4SOZoqI,TRUE,0,Placebo,FALSE,TRUE,standard,rapid,rapid,1699545040459,1699545476757,mate,"{'white': {'user': {'name': 'checkory', 'id': 'checkory'}, 'rating': 1346, 'ratingDiff': -6, 'analysis': {'inaccuracy': 5, 'mistake': 0, 'blunder': 1, 'acpl': 32, 'accuracy': 84}}, 'black': {'user': {'name': 'sandman353', 'id': 'sandman353'}, 'rating': 1266, 'ratingDiff': 14, 'analysis': {'inaccuracy': 3, 'mistake': 0, 'blunder': 1, 'acpl': 7, 'accuracy': 96}}}",black,e4 e5 d4 exd4 Qxd4 c5 Qa4 Nc6 Bb5 Nf6 Nc3 a6 Bxa6 Rxa6 Qb5 Nd4 Rb1 Nxb5 Nxb5 Nxe4 Nf3 Qa5+ Nc3 Nxc3 Bd2 Re6+ Kf1 Qb5+ Kg1 Nxb1 h3 Nxd2 Nxd2 Re1+ Kh2 Bd6+ g3 Rxh1+ Kxh1 Qxb2 Nc4 Qxc2 Nxd6+ Ke7 Nb5 Qxf2 Nc3 Qxg3 Ne2 Qxh3+ Kg1 Qe3+ Kf1 d5 Ng1 Bh3+ Nxh3 Qxh3+ Ke2 d4 Kd1 Qh2 a4 Rd8 a5 d3 a6 bxa6 Ke1 d2+ Kd1 c4 Kc2 d1=Q+ Kc3 Qhc2+ Kb4 Qdb1+ Kc5 Qb5#,"[{'eval': 36}, {'eval': 35}, {'eval': -17}, {'eval': 0}, {'eval': -5}, {'eval': 177, 'best': 'b8c6', 'variation': 'Nc6 Qe3 Nf6 Bd2 Be7 Nc3 d5 Nxd5 Nxd5 exd5', 'judgment': {'name': 'Blunder', 'comment': 'Blunder. Nc6 was best.'}}, {'eval': 110, 'best': 'd4e5', 'variation': 'Qe5+ Qe7 Qxe7+ Bxe7 Nc3 Nc6 Bf4 Nf6 O-O-O b6', 'judgment': {'name': 'Inaccuracy', 'comment': 'Inaccuracy. Qe5+ was best.'}}, {'eval': 119}, {'eval': 47, 'best': 'b1c3', 'variation': 'Nc3 a6 Nf3 Ra7 Nd5 b5 Qb3 Nf6 a4 c4', 'judgment': {'name': 'Inaccuracy', 'comment': 'Inaccuracy. Nc3 was best.'}}, {'eval': 34}, {'eval': -24, 'best': 'g1f3', 'variation': 'Nf3 a6', 'judgment': {'name': 'Inaccuracy', 'comment': 'Inaccuracy. Nf3 was best.'}}, {'eval': -35}, {'eval': -500, 'best': 'c1g5', 'variation': 'Bg5 Be7 Bxc6 dxc6 e5 b5 Qf4 Nd5 Bxe7 Qxe7 Nxd5 cxd5 c3 O-O', 'judgment': {'name': 'Blunder', 'comment': 'Blunder. Bg5 was best.'}}, {'eval': -481}, {'eval': -535}, {'eval': -536}, {'eval': -807, 'best': 'b5d3', 'variation': 'Qd3 d5 Bg5 dxe4 Qd2 h6 Bxf6 gxf6 Nge2 f5 Nf4 Bg7 Nh5 Be5', 'judgment': {'name': 'Inaccuracy', 'comment': 'Inaccuracy. Qd3 was best.'}}, {'eval': -790}, {'eval': -797}, {'eval': -753}, {'eval': -870}, {'eval': -870}, {'eval': -871}, {'eval': -875}, {'eval': -1280}, {'eval': -1289}, {'mate': -5, 'best': 'd2e3', 'variation': 'Be3 Nxb1+ Kd1 Qxa2 Re1 Qxb2 Bd2 Na3 Rxe6+ dxe6 Ne1 Qb1+ Ke2 Qb5+', 'judgment': {'name': 'Inaccuracy', 'comment': 'Checkmate is now unavoidable. Be3 was best.'}}, {'mate': -4}, {'mate': -4}, {'eval': -1317, 'best': 'c3e2', 'variation': 'Ne2+ Kf1 Ng3+ Kg1 Qf1+ Rxf1 Ne2#', 'judgment': {'name': 'Inaccuracy', 'comment': 'Lost forced checkmate sequence. Ne2+ was best.'}}, {'eval': -1315}, {'eval': -1403}, {'eval': -1485}, {'eval': -1485}, {'eval': -1481}, {'eval': -1490}, {'eval': -1474}, {'mate': -8}, {'mate': -8}, {'eval': -1171, 'best': 'b5e2', 'variation': 'Qe2 Ne4 Qxe4+ Kg1 Qe1+ Kg2 b6 b3 Bb7+ f3 Qe2+ Kg1 Qxf3 h4', 'judgment': {'name': 'Inaccuracy', 'comment': 'Lost forced checkmate sequence. Qe2 was best.'}}, {'eval': -1167}, {'mate': -10}, {'eval': -1666}, {'mate': -9}, {'mate': -17}, {'mate': -5}, {'mate': -4}, {'mate': -7}, {'mate': -5}, {'mate': -8}, {'mate': -12}, {'eval': -8543, 'best': 'h3f3', 'variation': 'Qf3 Nc1 Qe3+ Kg2 Qxc1 Kf3 Qa3+ Ke2 Qxa2+ Ke3 Qc2 Kf3 Qd2 Ke4', 'judgment': {'name': 'Inaccuracy', 'comment': 'Lost forced checkmate sequence. Qf3 was best.'}}, {'mate': -16}, {'mate': -7}, {'mate': -7}, {'mate': -6}, {'mate': -6}, {'mate': -5}, {'mate': -4}, {'mate': -5}, {'mate': -4}, {'mate': -3}, {'mate': -3}, {'mate': -3}, {'mate': -3}, {'mate': -2}, {'mate': -2}, {'mate': -1}, {'mate': -1}, {'mate': -2}, {'mate': -2}, {'mate': -2}, {'mate': -2}, {'mate': -1}, {'mate': -1}, {'mate': -2}, {'mate': -2}, {'mate': -1}, {'mate': -1}]","{'initial': 600, 'increment': 0, 'totalTime': 600}",1346,-6,5,0,1,32,84,checkory,1266,14,3,0,1,7,96,sandman353,white,1346,-6,5,0,1,32,84,checkory,Rated Rapid game,https://lichess.org/U4SOZoqI,2023.11.09,,checkory,sandman353,0-1,1. e4 e5 2. d4 exd4 3. Qxd4 c5 4. Qa4 Nc6 5. Bb5 Nf6 6. Nc3 a6 7. Bxa6 Rxa6 8. Qb5 Nd4 9. Rb1 Nxb5 10. Nxb5 Nxe4 11. Nf3 Qa5+ 12. Nc3 Nxc3 13. Bd2 Re6+ 14. Kf1 Qb5+ 15. Kg1 Nxb1 16. h3 Nxd2 17. Nxd2 Re1+ 18. Kh2 Bd6+ 19. g3 Rxh1+ 20. Kxh1 Qxb2 21. Nc4 Qxc2 22. Nxd6+ Ke7 23. Nb5 Qxf2 24. Nc3 Qxg3 25. Ne2 Qxh3+ 26. Kg1 Qe3+ 27. Kf1 d5 28. Ng1 Bh3+ 29. Nxh3 Qxh3+ 30. Ke2 d4 31. Kd1 Qh2 32. a4 Rd8 33. a5 d3 34. a6 bxa6 35. Ke1 d2+ 36. Kd1 c4 37. Kc2 d1=Q+ 38. Kc3 Qhc2+ 39. Kb4 Qdb1+ 40. Kc5 Qb5#,40,e4,e5,d4,exd4,Qxd4,c5,Qa4,Nc6,Bb5,Nf6,Nc3,a6,Bxa6,Rxa6,Qb5,Nd4,Rb1,Nxb5,Nxb5,Nxe4,Qb5#,TRUE,3,14,12,0,3,1,2,1,8,0,13,5,5,15,20,0,16,6
ULabDirA,TRUE,1,Chatty,FALSE,TRUE,standard,rapid,rapid,1699900755920,1699901330276,mate,"{'white': {'user': {'name': 'MarianObz', 'id': 'marianobz'}, 'rating': 1374, 'ratingDiff': -6, 'analysis': {'inaccuracy': 4, 'mistake': 4, 'blunder': 4, 'acpl': 91, 'accuracy': 68}}, 'black': {'user': {'name': 'sandman353', 'id': 'sandman353'}, 'rating': 1350, 'ratingDiff': 9, 'analysis': {'inaccuracy': 3, 'mistake': 1, 'blunder': 5, 'acpl': 63, 'accuracy': 74}}}",black,e4 e5 d4 exd4 Qxd4 c5 Qc4 Nf6 Nc3 Nc6 Be3 d6 O-O-O Be6 Qe2 Be7 Nd5 Nxe4 Nxe7 Qxe7 Bf4 d5 f3 O-O fxe4 d4 c4 Nb4 b3 Rad8 a3 Nc6 Qf3 Na5 Kb2 a6 Bd3 b5 cxb5 Nxb3 bxa6 Rb8 Kc2 c4 Be2 Qxa3 Bxb8 Rxb8 Nh3 d3+ Bxd3 Nd4+ Kd2 Nxf3+ gxf3 Qxd3+ Ke1 Qe3+ Kf1 Bxh3#,"[{'eval': 36}, {'eval': 35}, {'eval': -17}, {'eval': 0}, {'eval': -5}, {'eval': 177, 'best': 'b8c6', 'variation': 'Nc6 Qe3 Nf6 Bd2 Be7 Nc3 d5 Nxd5 Nxd5 exd5', 'judgment': {'name': 'Blunder', 'comment': 'Blunder. Nc6 was best.'}}, {'eval': 91, 'best': 'd4e5', 'variation': 'Qe5+ Qe7 Qxe7+ Bxe7 Nc3 Nc6 Bf4 Nf6 O-O-O b6', 'judgment': {'name': 'Inaccuracy', 'comment': 'Inaccuracy. Qe5+ was best.'}}, {'eval': 66}, {'eval': 85}, {'eval': 93}, {'eval': 52}, {'eval': 48}, {'eval': 55}, {'eval': 54}, {'eval': 27}, {'eval': 89, 'best': 'd8a5', 'variation': 'Qa5 Bd2 O-O-O Kb1 Qb6 Nh3 d5 Nxd5 Nxd5 exd5 Nd4 Qe3 Bxd5 Nf4', 'judgment': {'name': 'Inaccuracy', 'comment': 'Inaccuracy. Qa5 was best.'}}, {'eval': -75, 'best': 'f2f4', 'variation': 'f4 O-O', 'judgment': {'name': 'Mistake', 'comment': 'Mistake. f4 was best.'}}, {'eval': -57}, {'eval': -120, 'best': 'e3h6', 'variation': 'Bh6', 'judgment': {'name': 'Inaccuracy', 'comment': 'Inaccuracy. Bh6 was best.'}}, {'eval': -126}, {'eval': -184}, {'eval': -182}, {'eval': -172}, {'eval': 166, 'best': 'e4f6', 'variation': 'Nf6 Nh3 c4 Ng5 O-O Nxe6 fxe6 Kb1 b5 Bc1 Rae8 g4 Qc5 g5', 'judgment': {'name': 'Blunder', 'comment': 'Blunder. Nf6 was best.'}}, {'eval': 161}, {'eval': 168}, {'eval': 117}, {'eval': 200, 'best': 'a7a6', 'variation': 'a6', 'judgment': {'name': 'Inaccuracy', 'comment': 'Inaccuracy. a6 was best.'}}, {'eval': -190, 'best': 'a2a3', 'variation': 'a3', 'judgment': {'name': 'Blunder', 'comment': 'Blunder. a3 was best.'}}, {'eval': 167, 'best': 'a7a5', 'variation': 'a5 a3 a4 Qb2 axb3 Qxb3 b5 axb4 cxb4 Qb2 bxc4 Rxd4 Ra4 Bxc4', 'judgment': {'name': 'Blunder', 'comment': 'Blunder. a5 was best.'}}, {'eval': 182}, {'eval': 176}, {'eval': -80, 'best': 'g1f3', 'variation': 'Nf3', 'judgment': {'name': 'Blunder', 'comment': 'Blunder. Nf3 was best.'}}, {'eval': 117, 'best': 'b7b5', 'variation': 'b5 Qg3', 'judgment': {'name': 'Blunder', 'comment': 'Blunder. b5 was best.'}}, {'eval': -173, 'best': 'f4d2', 'variation': 'Bd2', 'judgment': {'name': 'Blunder', 'comment': 'Blunder. Bd2 was best.'}}, {'eval': 117, 'best': 'b7b5', 'variation': 'b5 Nh3', 'judgment': {'name': 'Blunder', 'comment': 'Blunder. b5 was best.'}}, {'eval': -134, 'best': 'f4d2', 'variation': 'Bd2 Nc6', 'judgment': {'name': 'Blunder', 'comment': 'Blunder. Bd2 was best.'}}, {'eval': -148}, {'eval': -274, 'best': 'g1e2', 'variation': 'Ne2 Nxb3 Kxb3 bxc4+ Bxc4 Qb7+ Kc2 Bxc4 Kd2 Rfe8 Ng3 Bb5 Nf5 c4', 'judgment': {'name': 'Inaccuracy', 'comment': 'Inaccuracy. Ne2 was best.'}}, {'eval': -277}, {'eval': -522, 'best': 'd3c2', 'variation': 'Bc2 Na5 Ne2 axb5 Qg3 Nc4+ Kc1 Kh8 Rd3 b4 a4 Ra8 e5 Qd7', 'judgment': {'name': 'Mistake', 'comment': 'Mistake. Bc2 was best.'}}, {'eval': -355, 'best': 'c5c4', 'variation': 'c4 Bxc4 Bxc4 Bh6 gxh6 Qg3+ Kh8 Nf3 Na5 a7 Qxa7 Nxd4 Rb8+ Kc2', 'judgment': {'name': 'Inaccuracy', 'comment': 'Inaccuracy. c4 was best.'}}, {'eval': -533, 'best': 'f3g3', 'variation': 'Qg3 Rb6', 'judgment': {'name': 'Inaccuracy', 'comment': 'Inaccuracy. Qg3 was best.'}}, {'eval': -555}, {'eval': -686}, {'eval': -791}, {'mate': -1, 'best': 'd1c1', 'variation': 'Rc1 d3+ Kd1 Nxc1 Bxc1 Rb1 Qf4 Rd8 Bxd3 cxd3 Qd2 Rxc1+ Qxc1 Qxc1+', 'judgment': {'name': 'Mistake', 'comment': 'Checkmate is now unavoidable. Rc1 was best.'}}, {'mate': -5}, {'mate': -1}, {'mate': -7}, {'mate': -5}, {'eval': -889, 'best': 'a3a2', 'variation': 'Qa2+ Kc3 Qa5+ Kc2 Nd4+ Kc1 Qc3+ Bc2 Qxc2#', 'judgment': {'name': 'Mistake', 'comment': 'Lost forced checkmate sequence. Qa2+ was best.'}}, {'eval': -852}, {'eval': -888}, {'mate': -3, 'best': 'd2e3', 'variation': 'Ke3 Ne5 Rhf1 cxd3 Kf2 Qc5+ Kg3 Qe3+ Rf3 Qxe4 Nf4 g5 h3 gxf4+', 'judgment': {'name': 'Mistake', 'comment': 'Checkmate is now unavoidable. Ke3 was best.'}}, {'mate': -2}, {'mate': -2}, {'mate': -1}, {'mate': -1}]","{'initial': 600, 'increment': 0, 'totalTime': 600}",1374,-6,4,4,4,91,68,MarianObz,1350,9,3,1,5,63,74,sandman353,white,1374,-6,4,4,4,91,68,MarianObz,Rated Rapid game,https://lichess.org/ULabDirA,2023.11.13,,MarianObz,sandman353,0-1,1. e4 e5 2. d4 exd4 3. Qxd4 c5 4. Qc4 Nf6 5. Nc3 Nc6 6. Be3 d6 7. O-O-O Be6 8. Qe2 Be7 9. Nd5 Nxe4 10. Nxe7 Qxe7 11. Bf4 d5 12. f3 O-O 13. fxe4 d4 14. c4 Nb4 15. b3 Rad8 16. a3 Nc6 17. Qf3 Na5 18. Kb2 a6 19. Bd3 b5 20. cxb5 Nxb3 21. bxa6 Rb8 22. Kc2 c4 23. Be2 Qxa3 24. Bxb8 Rxb8 25. Nh3 d3+ 26. Bxd3 Nd4+ 27. Kd2 Nxf3+ 28. gxf3 Qxd3+ 29. Ke1 Qe3+ 30. Kf1 Bxh3#,30,e4,e5,d4,exd4,Qxd4,c5,Qc4,Nf6,Nc3,Nc6,Be3,d6,O-O-O,Be6,Qe2,Be7,Nd5,Nxe4,Nxe7,Qxe7,Bxh3#,TRUE,6,6,4,1,4,1,3,1,9,1,4,4,9,7,13,2,8,5
XDtDnK8J,TRUE,0,Chatty,FALSE,TRUE,standard,rapid,rapid,1699541689311,1699542113747,mate,"{'white': {'user': {'name': 'kokoko0', 'id': 'kokoko0'}, 'rating': 1134, 'ratingDiff': -57, 'provisional': True, 'analysis': {'inaccuracy': 3, 'mistake': 3, 'blunder': 2, 'acpl': 136, 'accuracy': 58}}, 'black': {'user': {'name': 'sandman353', 'id': 'sandman353'}, 'rating': 1268, 'ratingDiff': 9, 'analysis': {'inaccuracy': 0, 'mistake': 2, 'blunder': 2, 'acpl': 99, 'accuracy': 66}}}",black,e4 e5 Nf3 Nc6 Bc4 Nf6 h3 Nxe4 Qe2 d5 Nxe5 Nxe5 Bb3 Bc5 f3 Ng3 Qxe5+ Be6 Qxg3 O-O Nc3 Re8 Ne2 d4 c3 Bxb3 axb3 d3 b4 Rxe2+ Kd1 Bf2 Qh2 Qe7 g3 Re1+ Rxe1 Qxe1#,"[{'eval': 36}, {'eval': 35}, {'eval': 29}, {'eval': 32}, {'eval': 21}, {'eval': 29}, {'eval': -33, 'best': 'f3g5', 'variation': 'Ng5 d5 exd5 Na5 Bb5+ c6 dxc6 bxc6 Be2 h6', 'judgment': {'name': 'Inaccuracy', 'comment': 'Inaccuracy. Ng5 was best.'}}, {'eval': -70}, {'eval': -201, 'best': 'e1h1', 'variation': 'O-O d6 Bb5 Nf6 d4 e4 d5 a6 Ba4 exf3', 'judgment': {'name': 'Mistake', 'comment': 'Mistake. O-O was best.'}}, {'eval': -241}, {'eval': -483, 'best': 'd2d3', 'variation': 'd3 Nxf2 Nxe5 Qe7 Kxf2 Nd4 Qd1 dxc4 Re1 Be6', 'judgment': {'name': 'Mistake', 'comment': 'Mistake. d3 was best.'}}, {'eval': -471}, {'eval': -482}, {'eval': -502}, {'eval': -971, 'best': 'd2d3', 'variation': 'd3 Bxf2+ Kd1 O-O Rf1 Bd4 dxe4 dxe4 c3 Bf2+ Qd2 Nd3 Bc4 Bc5', 'judgment': {'name': 'Mistake', 'comment': 'Mistake. d3 was best.'}}, {'eval': -423, 'best': 'd8h4', 'variation': 'Qh4+ Kd1 Nf2+ Qxf2 Bxf2 d4 Qg3 Nd2 Qxg2 Rf1 Bxd4 c3 Bf2 Bxd5', 'judgment': {'name': 'Mistake', 'comment': 'Mistake. Qh4+ was best.'}}, {'eval': -417}, {'eval': 241, 'best': 'd8e7', 'variation': 'Qe7 Qxe7+ Kxe7 d4 Bxd4 Nc3 Bxc3+ bxc3 Nxh1 Bf4 Be6 Kd2 a5 a4', 'judgment': {'name': 'Blunder', 'comment': 'Blunder. Qe7 was best.'}}, {'eval': 268}, {'eval': 250}, {'eval': 249}, {'eval': 235}, {'eval': 157, 'best': 'e1d1', 'variation': 'Kd1 Be7 d4 Bh4 Qh2 a5 Bf4 c5 dxc5 a4 Nxa4 d4 g3 Bf6', 'judgment': {'name': 'Inaccuracy', 'comment': 'Inaccuracy. Kd1 was best.'}}, {'eval': 296, 'best': 'a7a5', 'variation': 'a5 a4', 'judgment': {'name': 'Mistake', 'comment': 'Mistake. a5 was best.'}}, {'eval': -439, 'best': 'd2d3', 'variation': 'd3 Bb4+ Kd1 Bxb3 axb3 Qf6 h4 a5 Qf2 b5 Ng3 a4 bxa4 Qe5', 'judgment': {'name': 'Blunder', 'comment': 'Blunder. d3 was best.'}}, {'eval': -567}, {'eval': -573}, {'eval': -548}, {'mate': -7, 'best': 'e1d1', 'variation': 'Kd1 Rxe2 f4 Qd5 c4 Qe4 Qf3 Qxf3 gxf3 Rae8 Ra5 b6 b4 bxa5', 'judgment': {'name': 'Blunder', 'comment': 'Checkmate is now unavoidable. Kd1 was best.'}}, {'eval': -613, 'best': 'd8e7', 'variation': 'Qe7 Qf2 Bxf2+ Kxf2 Qh4+ Kg1 Rxe2 Kh2 Qf4+ Kg1 Qg3 b3 Qxg2#', 'judgment': {'name': 'Blunder', 'comment': 'Lost forced checkmate sequence. Qe7 was best.'}}, {'eval': -1167, 'best': 'e1f1', 'variation': 'Kf1 Bb6 c4 Bd4 Ra3 Rf2+ Qxf2 Bxf2 Kxf2 Qh4+ Ke3 Rd8 g4 h5', 'judgment': {'name': 'Inaccuracy', 'comment': 'Inaccuracy. Kf1 was best.'}}, {'mate': -23}, {'mate': -5}, {'mate': -4}, {'mate': -2}, {'mate': -1}, {'mate': -1}]","{'initial': 600, 'increment': 0, 'totalTime': 600}",1134,-57,3,3,2,136,58,kokoko0,1268,9,0,2,2,99,66,sandman353,white,1134,-57,3,3,2,136,58,kokoko0,Rated Rapid game,https://lichess.org/XDtDnK8J,2023.11.09,,kokoko0,sandman353,0-1,1. e4 e5 2. Nf3 Nc6 3. Bc4 Nf6 4. h3 Nxe4 5. Qe2 d5 6. Nxe5 Nxe5 7. Bb3 Bc5 8. f3 Ng3 9. Qxe5+ Be6 10. Qxg3 O-O 11. Nc3 Re8 12. Ne2 d4 13. c3 Bxb3 14. axb3 d3 15. b4 Rxe2+ 16. Kd1 Bf2 17. Qh2 Qe7 18. g3 Re1+ 19. Rxe1 Qxe1#,19,e4,e5,Nf3,Nc6,Bc4,Nf6,h3,Nxe4,Qe2,d5,Nxe5,Nxe5,Bb3,Bc5,f3,Ng3,Qxe5+,Be6,Qxg3,O-O,Qxe1#,TRUE,2,1,4,0,4,1,4,1,5,1,2,4,6,2,9,1,6,5
YOaiDbgU,TRUE,0,Chatty,FALSE,TRUE,standard,rapid,rapid,1699903766550,1699904492443,resign,"{'white': {'user': {'name': 'Kleprq', 'id': 'kleprq'}, 'rating': 1370, 'ratingDiff': -6, 'analysis': {'inaccuracy': 4, 'mistake': 0, 'blunder': 1, 'acpl': 29, 'accuracy': 91}}, 'black': {'user': {'name': 'sandman353', 'id': 'sandman353'}, 'rating': 1364, 'ratingDiff': 7, 'analysis': {'inaccuracy': 0, 'mistake': 1, 'blunder': 0, 'acpl': 14, 'accuracy': 96}}}",black,e4 e5 Bc4 Nc6 Qf3 Nf6 d3 Nd4 Qd1 d5 Bb3 dxe4 dxe4 Nxe4 c3 Nxb3 Qxd8+ Kxd8 axb3 Bc5 Be3 Bxe3 fxe3 Be6 c4 Ke7 Nf3 Rhd8 Nxe5 f6 Nf3 Rd3 Nbd2 Rxe3+ Kf1 Nxd2+ Nxd2 Rd8 Nf3 Rxb3 Rxa7 Bxc4+ Kf2 Rxb2+ Kg3 Bd5 Raa1 Bxf3 gxf3 Rdd2 Rae1+ Kf7 Reg1 c5 Kf4 Rb4+ Ke3 Rbb2 h4 Re2+ Kd3 Red2+ Kc3 Rdc2+ Kd3 Rd2+ Kc4 b6 Rc1 Rd4+ Kc3 Rf2 Rhf1 Rxf1 Rxf1 Rxh4 Kb3 Rf4 Kc3 g5 Kd3 h5 Rh1 h4 Rh3 b5 Kc3 b4+ Kb3 Ke6 Ka4 c4 Kxb4 Kd5 Kc3 f5 Kb4 Kd4 Ka3 c3 Kb3 Kd3 Rh1 Rxf3 Rc1 h3 Rxc3+ Ke4 Rxf3 Kxf3 Kc4,"[{'eval': 36}, {'eval': 35}, {'eval': 0}, {'eval': 21}, {'eval': 0}, {'eval': 0}, {'eval': -90, 'best': 'g1e2', 'variation': 'Ne2 d6 Nbc3 Bg4 Qe3 Nb4 Bb3 Be6 Ba4+ Bd7', 'judgment': {'name': 'Inaccuracy', 'comment': 'Inaccuracy. Ne2 was best.'}}, {'eval': -71}, {'eval': -91}, {'eval': -133}, {'eval': -396, 'best': 'e4d5', 'variation': 'exd5 b5 Bb3 a5 c3 Nxb3 axb3 Nxd5 Nf3 Bd6', 'judgment': {'name': 'Blunder', 'comment': 'Blunder. exd5 was best.'}}, {'eval': -216, 'best': 'd4b3', 'variation': 'Nxb3 axb3 dxe4 Nc3 Bf5 Qe2 exd3 Qxe5+ Qe7 Qxe7+', 'judgment': {'name': 'Mistake', 'comment': 'Mistake. Nxb3 was best.'}}, {'eval': -220}, {'eval': -219}, {'eval': -278}, {'eval': -287}, {'eval': -269}, {'eval': -265}, {'eval': -264}, {'eval': -284}, {'eval': -276}, {'eval': -276}, {'eval': -268}, {'eval': -264}, {'eval': -313}, {'eval': -328}, {'eval': -328}, {'eval': -313}, {'eval': -331}, {'eval': -322}, {'eval': -332}, {'eval': -347}, {'eval': -464, 'best': 'e1h1', 'variation': 'O-O Rxb3 Nd4 Rxb2 Rf4 Nc5 Nc3 Kf7 Nd5 c6 Nc7 Rd8 h4 a6', 'judgment': {'name': 'Inaccuracy', 'comment': 'Inaccuracy. O-O was best.'}}, {'eval': -490}, {'eval': -479}, {'eval': -462}, {'eval': -472}, {'eval': -406}, {'eval': -525, 'best': 'a1e1', 'variation': 'Re1 Red3 Ne4 Rxb3 Nc5 Rb6 b3 Rdd6 Kf2 Rdc6 Rxe6+ Rxe6 Nxe6 Rxe6', 'judgment': {'name': 'Inaccuracy', 'comment': 'Inaccuracy. Re1 was best.'}}, {'eval': -503}, {'eval': -636}, {'eval': -545}, {'eval': -535}, {'eval': -540}, {'eval': -536}, {'eval': -532}, {'eval': -540}, {'eval': -511}, {'eval': -504}, {'eval': -507}, {'eval': -514}, {'eval': -518}, {'eval': -542}, {'eval': -573}, {'eval': -597}, {'eval': -594}, {'eval': -568}, {'eval': -561}, {'eval': -563}, {'eval': -569}, {'eval': -588}, {'eval': -545}, {'eval': -596}, {'eval': -534}, {'eval': -550}, {'eval': -548}, {'eval': -536}, {'eval': -541}, {'eval': -601}, {'eval': -604}, {'eval': -595}, {'eval': -605}, {'eval': -636}, {'eval': -634}, {'eval': -624}, {'eval': -634}, {'eval': -685}, {'eval': -677}, {'eval': -670}, {'eval': -672}, {'eval': -685}, {'eval': -688}, {'eval': -686}, {'eval': -680}, {'eval': -731}, {'eval': -724}, {'eval': -735}, {'eval': -753}, {'eval': -761}, {'eval': -796}, {'eval': -773}, {'eval': -734}, {'eval': -755}, {'eval': -776}, {'eval': -759}, {'eval': -778}, {'eval': -856}, {'eval': -791}, {'eval': -866}, {'eval': -936}, {'eval': -1047}, {'eval': -961}, {'eval': -959}, {'eval': -930}, {'eval': -1109}, {'eval': -1053}, {'eval': -1859}, {'eval': -1974}, {'mate': -13}, {'eval': -2329}, {'mate': -10, 'best': 'b3c2', 'variation': 'Kc2 h2 Kb3 f4 Kb4 Kg2 Kc5 f3 Kd6 g4 Ke7 h1=Q Ke6 g3', 'judgment': {'name': 'Inaccuracy', 'comment': 'Checkmate is now unavoidable. Kc2 was best.'}}]","{'initial': 600, 'increment': 0, 'totalTime': 600}",1370,-6,4,0,1,29,91,Kleprq,1364,7,0,1,0,14,96,sandman353,white,1370,-6,4,0,1,29,91,Kleprq,Rated Rapid game,https://lichess.org/YOaiDbgU,2023.11.13,,Kleprq,sandman353,0-1,1. e4 e5 2. Bc4 Nc6 3. Qf3 Nf6 4. d3 Nd4 5. Qd1 d5 6. Bb3 dxe4 7. dxe4 Nxe4 8. c3 Nxb3 9. Qxd8+ Kxd8 10. axb3 Bc5 11. Be3 Bxe3 12. fxe3 Be6 13. c4 Ke7 14. Nf3 Rhd8 15. Nxe5 f6 16. Nf3 Rd3 17. Nbd2 Rxe3+ 18. Kf1 Nxd2+ 19. Nxd2 Rd8 20. Nf3 Rxb3 21. Rxa7 Bxc4+ 22. Kf2 Rxb2+ 23. Kg3 Bd5 24. Raa1 Bxf3 25. gxf3 Rdd2 26. Rae1+ Kf7 27. Reg1 c5 28. Kf4 Rb4+ 29. Ke3 Rbb2 30. h4 Re2+ 31. Kd3 Red2+ 32. Kc3 Rdc2+ 33. Kd3 Rd2+ 34. Kc4 b6 35. Rc1 Rd4+ 36. Kc3 Rf2 37. Rhf1 Rxf1 38. Rxf1 Rxh4 39. Kb3 Rf4 40. Kc3 g5 41. Kd3 h5 42. Rh1 h4 43. Rh3 b5 44. Kc3 b4+ 45. Kb3 Ke6 46. Ka4 c4 47. Kxb4 Kd5 48. Kc3 f5 49. Kb4 Kd4 50. Ka3 c3 51. Kb3 Kd3 52. Rh1 Rxf3 53. Rc1 h3 54. Rxc3+ Ke4 55. Rxf3 Kxf3 56. Kc4,56,e4,e5,Bc4,Nc6,Qf3,Nf6,d3,Nd4,Qd1,d5,Bb3,dxe4,dxe4,Nxe4,c3,Nxb3,Qxd8+,Kxd8,axb3,Bc5,Kc4,TRUE,3,22,6,0,3,13,6,9,6,0,0,19,9,31,12,0,3,32
ZvDbHkEf,TRUE,1,Chatty,FALSE,TRUE,standard,rapid,rapid,1699541387938,1699541644590,draw,"{'white': {'user': {'name': 'Qdsaulieu', 'id': 'qdsaulieu'}, 'rating': 1281, 'ratingDiff': -1, 'analysis': {'inaccuracy': 3, 'mistake': 1, 'blunder': 0, 'acpl': 34, 'accuracy': 86}}, 'black': {'user': {'name': 'sandman353', 'id': 'sandman353'}, 'rating': 1268, 'ratingDiff': 0, 'analysis': {'inaccuracy': 0, 'mistake': 1, 'blunder': 1, 'acpl': 36, 'accuracy': 81}}}","",e4 e5 f3 Nc6 a3 Nf6 c3 d5 d4 dxe4 dxe5 Qxd1+ Kxd1 Nxe5 fxe4 Nxe4 Bf4 Nf2+ Ke2 Nxh1 Bxe5 Bg4+ Nf3 O-O-O Nd2 f6 Bd4 Re8+ Kd3 Bf5+ Kc4 Be6+ Kd3 Bf5+ Kc4 Be6+ Kd3 Bf5+,"[{'eval': 36}, {'eval': 35}, {'eval': -91, 'best': 'g1f3', 'variation': 'Nf3 Nc6 Bb5 Nf6 O-O Nxe4 Re1 Nd6 Nxe5 Be7', 'judgment': {'name': 'Mistake', 'comment': 'Mistake. Nf3 was best.'}}, {'eval': -81}, {'eval': -131}, {'eval': -90}, {'eval': -160, 'best': 'b1c3', 'variation': 'Nc3 d5 Bb5 Bc5 d3 O-O Na4 Bd6 Bxc6 bxc6', 'judgment': {'name': 'Inaccuracy', 'comment': 'Inaccuracy. Nc3 was best.'}}, {'eval': -190}, {'eval': -200}, {'eval': -211}, {'eval': -289, 'best': 'f1b5', 'variation': 'Bb5 exd4 cxd4 Qe7 Ne2 exf3 gxf3 Bd7 Nc3 O-O-O Ba4 Qe6 Bf4 Nd5', 'judgment': {'name': 'Inaccuracy', 'comment': 'Inaccuracy. Bb5 was best.'}}, {'eval': -304}, {'eval': -279}, {'eval': -285}, {'eval': -430, 'best': 'b1d2', 'variation': 'Nd2 Bf5 g4 Bg6 g5 O-O-O gxf6 e3 Ke1 exd2+ Bxd2 gxf6 Be3 Nd3+', 'judgment': {'name': 'Inaccuracy', 'comment': 'Inaccuracy. Nd2 was best.'}}, {'eval': -463}, {'eval': -545}, {'eval': -541}, {'eval': -555}, {'eval': -488}, {'eval': -463}, {'eval': -480}, {'eval': -519}, {'eval': -521}, {'eval': -493}, {'eval': -528}, {'eval': -533}, {'eval': -267, 'best': 'f8d6', 'variation': 'Bd6 Ne4 Rhe8 Kd2 Rxe4 Bd3 Rxd4 Nxd4 Nf2 Bxh7 c5 h3 Bd7 Nf5', 'judgment': {'name': 'Mistake', 'comment': 'Mistake. Bd6 was best.'}}, {'eval': -296}, {'eval': -285}, {'eval': -289}, {'eval': -292}, {'eval': -286}, {'eval': -284}, {'eval': -276}, {'eval': -273}, {'eval': -276}, {'eval': 0, 'best': 'c7c5', 'variation': 'c5 Bg1 Bf5+ Kc4 g5 Kb3 h5 Bb5 Rd8 Bc4 h4 Rf1 h3 g3', 'judgment': {'name': 'Blunder', 'comment': 'Blunder. c5 was best.'}}]","{'initial': 600, 'increment': 0, 'totalTime': 600}",1281,-1,3,1,0,34,86,Qdsaulieu,1268,0,0,1,1,36,81,sandman353,white,1281,-1,3,1,0,34,86,Qdsaulieu,Rated Rapid game,https://lichess.org/ZvDbHkEf,2023.11.09,,Qdsaulieu,sandman353,1/2-1/2,1. e4 e5 2. f3 Nc6 3. a3 Nf6 4. c3 d5 5. d4 dxe4 6. dxe5 Qxd1+ 7. Kxd1 Nxe5 8. fxe4 Nxe4 9. Bf4 Nf2+ 10. Ke2 Nxh1 11. Bxe5 Bg4+ 12. Nf3 O-O-O 13. Nd2 f6 14. Bd4 Re8+ 15. Kd3 Bf5+ 16. Kc4 Be6+ 17. Kd3 Bf5+ 18. Kc4 Be6+ 19. Kd3 Bf5+,19,e4,e5,f3,Nc6,a3,Nf6,c3,d5,d4,dxe4,dxe5,Qxd1+,Kxd1,Nxe5,fxe4,Nxe4,Bf4,Nf2+,Ke2,Nxh1,Bf5+,TRUE,3,7,2,0,0,0,6,1,6,1,1,2,9,8,8,1,1,2
